Title,Price,Rating,Link,Description
"CyberPowerPC Gamer Xtreme VR Gaming PC, Intel Core i5-13400F 2.5GHz, GeForce RTX 4060 8GB, 16GB DDR5, 1TB PCIe Gen4 SSD, WiFi Ready & Windows 11 Home (GXiVR8060A24)",899.99,4.4,https://www.amazon.com/CyberPowerPC-i5-13400F-GeForce-Windows-GXiVR8060A24/dp/B0DCMPRRFD/ref=sr_1_1?dib=eyJ2IjoiMSJ9.9mcadjYfGkCGNRSpf4OtmOtT6vZeuAykrxBJYpx3QYQnEzOJMvaoSji36PofYWZ-jQ6zrTDyMEO1lGzw2VHMnAYXhs7kelZLHtGqca8-TmaKNCiiYUzJ2eCPTcrfD7aoeKlBktQzrSlHXSz_ojAPkW5SATgIMrhK9_K5wXE3ahkri20fBJeo4lGRM7jbdvWBzaxKqWbtl-ZBu75MxgasKNhKQL7wVRupNSPhLXva2j0OWexiZzIi1qHTdJ4g_tUrdY4l-O-VBUhr9XXY55aybAGC1lwN-RK3Bf0UKuvtRu0Vn9-b6odNa9Sup557xInGcGY_0HGHvGyJeiNGMNKskPZYBC1kHE6eSnIg2xhBKv5UfzDpAakwGUdgapoiMm3hmavuYjvYESIHx-MG-BbT6wC2Eip2cVaLOUrXXp6oKFOnXSq05kt2f2rYhakXqucu.zcc2b-jDv5aTB3JshWR0WyRbbu9T9jldAPBtUqXMxO4&dib_tag=se&keywords=gaming&qid=1738000800&sr=8-1,"About this item System: Intel Core i5-13400F 2.5GHz 6+4 Cores | Intel B760 Chipset | 16GB DDR5 | 1TB PCIe Gen4 NVMe SSD | Windows 11 Home 64-bit Graphics: NVIDIA GeForce RTX 4060 8GB Graphics | 1x HDMI | 2x DisplayPort Connectivity: 5 x USB 3.1 | 4 x USB 2.0 | 1 x LAN 1G | WiFi 5 | Bluetooth 4.2 | 7.1 Channel Audio | Keyboard and Mouse Tempered Side Case Panel | Custom RGB Lighting 1 Year Parts & Labor Warranty, Free Lifetime Tech Support › See more product details"
"Gaming Laptop AMD Ryzen 7 5825U(8C/16T), Radeon RX Vega 8 Graphics,16.1“FHD Display,16GB DDR4 512GB NVMe SSD Laptop Computer with Backlit KB,Type_C (Full Function),WiFi 6, 53Wh Battery",1699.99,4.4,https://www.amazon.com/MALLRACE-Graphics-Display-Computer-Function/dp/B0DKJM6L2L/ref=sr_1_2?dib=eyJ2IjoiMSJ9.9mcadjYfGkCGNRSpf4OtmOtT6vZeuAykrxBJYpx3QYQnEzOJMvaoSji36PofYWZ-jQ6zrTDyMEO1lGzw2VHMnAYXhs7kelZLHtGqca8-TmaKNCiiYUzJ2eCPTcrfD7aoeKlBktQzrSlHXSz_ojAPkW5SATgIMrhK9_K5wXE3ahkri20fBJeo4lGRM7jbdvWBzaxKqWbtl-ZBu75MxgasKNhKQL7wVRupNSPhLXva2j0OWexiZzIi1qHTdJ4g_tUrdY4l-O-VBUhr9XXY55aybAGC1lwN-RK3Bf0UKuvtRu0Vn9-b6odNa9Sup557xInGcGY_0HGHvGyJeiNGMNKskPZYBC1kHE6eSnIg2xhBKv5UfzDpAakwGUdgapoiMm3hmavuYjvYESIHx-MG-BbT6wC2Eip2cVaLOUrXXp6oKFOnXSq05kt2f2rYhakXqucu.zcc2b-jDv5aTB3JshWR0WyRbbu9T9jldAPBtUqXMxO4&dib_tag=se&keywords=gaming&qid=1738000800&sr=8-2,"About this item 【Better Gaming Experience】 MALLRACE 2024 Newest AX16PRO gaming laptop is powered by AMD Ryzen 7 5825U processor (8C16T, up to 4.3GHz). Its powerful and upgraded performance ensures smooth game operation and high-quality display. Provide immersive gaming experience for gamers. 【LARGE MEMORY STORAGE】 The ryzen 7 laptop comes with up to 16GB of DDR4 memory, which responds faster to your commands. The built-in 512GB M.2 NVMe SSD is enough to accommodate system files and massive data, excellent reading and writing speed greatly shortening your startup time. Dual channel DDR4 memory support upgrade to 64GB (2x32GB), support NVME/NGFF SSD upgrade to 2TB. 【16.1"" FHD IPS Display】 This 16.1 inch laptop pc features an innovative thin-bezel display that provides more usable onscreen space for immersive FHD viewing. It comes with Webcam×1, HDMI×1, Type_C (Full function)×1, 3.5mm Audio/Mic×1, TF Card Socket×1, Type_C DC Jack×1, USB3.2×2, USB2.0×1. Also paired with a backlit keyboard and numeric keypad, providing you with a full range of control comfort. 【Rich and High-quality Scalability】 Designed for ultra-fast gaming, MALLRACE Newest AX16PRO equipped with webcam × 1, USB 3.2 × 2, HDMI × 1, Type_C (full function) × 1, 3.5mm audio/microphone × 1, TF card holder × 1, Type_C DC jack × 1. Enjoy higher speeds with Wi-Fi 6, compatible with the 802.11ax standard and up to 3x faster than Wi-Fi 5. Paired with the backlit keyboard, it help you more immersed in the game world. 【MALLRACE CARE FOR YOU】 This traditional laptop computer is designed with a metal shell to resist pressure and impact, and its 53Wh long battery life gives you the flexibility to work or play anywhere without carrying a power adaptor, while being thin and light enough to easily slip into a backpack. We offer lifetime technical support and 12 months quality warranty for customers. If you have any questions, please feel free to contact us. › See more product details"
"Auto Clicker for Smart Phone, Phone Screen Device Speed Clicker for Android IOS Apps, Fast Click Simulation Finger Continuous Click for Gaming, Live Broadcasts Likes, Adjustable Speed Physical Clicker",11.98,4.1,https://www.amazon.com/Simulation-Continuous-Broadcasts-Adjustable-Physical-Smartphone/dp/B0DDC76195/ref=sr_1_3?dib=eyJ2IjoiMSJ9.9mcadjYfGkCGNRSpf4OtmOtT6vZeuAykrxBJYpx3QYQnEzOJMvaoSji36PofYWZ-jQ6zrTDyMEO1lGzw2VHMnAYXhs7kelZLHtGqca8-TmaKNCiiYUzJ2eCPTcrfD7aoeKlBktQzrSlHXSz_ojAPkW5SATgIMrhK9_K5wXE3ahkri20fBJeo4lGRM7jbdvWBzaxKqWbtl-ZBu75MxgasKNhKQL7wVRupNSPhLXva2j0OWexiZzIi1qHTdJ4g_tUrdY4l-O-VBUhr9XXY55aybAGC1lwN-RK3Bf0UKuvtRu0Vn9-b6odNa9Sup557xInGcGY_0HGHvGyJeiNGMNKskPZYBC1kHE6eSnIg2xhBKv5UfzDpAakwGUdgapoiMm3hmavuYjvYESIHx-MG-BbT6wC2Eip2cVaLOUrXXp6oKFOnXSq05kt2f2rYhakXqucu.zcc2b-jDv5aTB3JshWR0WyRbbu9T9jldAPBtUqXMxO4&dib_tag=se&keywords=gaming&qid=1738000800&sr=8-3,"About this item 【Advanced Silent Operation】This Phone Screen Auto-clicker is using spatial mapping click technology to replace the traditional mechanical click method, mute click, zero noise, and has a longer service life, adopting an innovative technology does not damage the screen of mobile phones, more sensitive and stable. 【Effortless Operation】Simply attach the click head or use the screen clip to replicate automatic finger taps. Connecting the USB interface to a power source allows immediate use, liberating your hands. Ideal for gaming, live broadcasting, and task completion with efficiency. 【Customizable Clicking Speed】Tailor your phone screen auto-clicker to suit your exact needs. Featuring 108 adjustable speed settings, you have the freedom to choose between an incredibly fast rate of 99 clicks per second or a more leisurely pace of just 1 click every 9 seconds. You can save your preferred speed and enjoy finger-like, irregular click patterns for an uninterrupted experience. 【LED display Design 】 With a built-in LED digital display that allows you to see the number of clicks, easy and convenient to operate and use, adopting an intelligent digital display to make your operation more convenient. 【Instructions for Use】Activate BOOT Mode - Begin by pressing the BOOT button to engage the device in BOOT status, where the screen will display a numerical count. Proceed by pressing the start button to initiate the clicking action, indicated by a flashing blue light. To modify the frequency while in BOOT mode, simply hold down the BOOT key for an extended adjustment. › See more product details"
"Gaming Laptop AMD Ryzen 7 5825U 16.1-inch IPS 16GB DDR4 (2 * 8GB, Dual Channel) 512GB M.2 2280 NVMe SSD Backlit Keyboard WIFI6 HDMI Type-C USB",1699.99,4.5,https://www.amazon.com/KAIGERR-16-1-inch-Channel-Backlit-Keyboard/dp/B0DP2D91LD/ref=sr_1_4?dib=eyJ2IjoiMSJ9.9mcadjYfGkCGNRSpf4OtmOtT6vZeuAykrxBJYpx3QYQnEzOJMvaoSji36PofYWZ-jQ6zrTDyMEO1lGzw2VHMnAYXhs7kelZLHtGqca8-TmaKNCiiYUzJ2eCPTcrfD7aoeKlBktQzrSlHXSz_ojAPkW5SATgIMrhK9_K5wXE3ahkri20fBJeo4lGRM7jbdvWBzaxKqWbtl-ZBu75MxgasKNhKQL7wVRupNSPhLXva2j0OWexiZzIi1qHTdJ4g_tUrdY4l-O-VBUhr9XXY55aybAGC1lwN-RK3Bf0UKuvtRu0Vn9-b6odNa9Sup557xInGcGY_0HGHvGyJeiNGMNKskPZYBC1kHE6eSnIg2xhBKv5UfzDpAakwGUdgapoiMm3hmavuYjvYESIHx-MG-BbT6wC2Eip2cVaLOUrXXp6oKFOnXSq05kt2f2rYhakXqucu.zcc2b-jDv5aTB3JshWR0WyRbbu9T9jldAPBtUqXMxO4&dib_tag=se&keywords=gaming&qid=1738000800&sr=8-4,"About this item [Top Performance Processors] KAIGERR Gaming Laptop R7-5825U by AMD ZEN 3 architecture, matched with 16MB of L3 cache, built by TSMC 7nm process with 8 cores & 16 threads (base 2.0GHz, turbo up to 4.5GHz). KAIGERR gaming laptops makes it easy to qualify for your PC work and PC games which have amazing loading and processing power for a smoother PC used experience [Huge Capacity Storage] KAIGERR laptop comes with 16GB SODIMM DDR4 RAM, advantages of large operating memory capacity both can reduce read latency of memory data and improve CPU utilization. KAIGERR laptop computer configured with an M.2 2280 NVMe 512GB SSD which offers fast startup and loading of applications, as well as a large amount of storage space for your various files [Brilliant Display & Integrated Graphics] KAIGERR mini laptop pc features an innovative thin-bezel display that provides more usable onscreen space for immersive FHD viewing. KAIGERR laptop integrates with AMD Radeon Graphics and delivers strong graphics processing like a rich level of image detail making it possible to play computer games or edit pictures with a great experience on this laptop [Rich Interfaces & Wireless Connectivity] KAIGERR traditional laptop offers a variety of connectivity options, including HDMI, Type-C, 3.5mm TRRS Jack, Memory Card Slot and USB3.2 ports. You can easily connect to various devices and peripherals to expand your capabilities. Mini laptop computers equipped with WiFi6 & Bluetooth 5.2 which offer strong wireless signal, fast wireless connections, and reliable transmission speed [Portable Design & Durable] KAIGERR windows laptop compact design makes it easy to carry with you wherever you go. Also, you can enjoy the benefits of a powerful computer without the bulk of a traditional desktop. KAIGERR laptop gaming computers are built with high-quality components and designed to handle heavy workloads and deliver consistent performance and longevity. If you encounter any problems, please contact us and we will help you solve the problem within 12 hours › See more product details"
"Acer Nitro V Gaming Laptop | Intel Core i7-13620H Processor | NVIDIA GeForce RTX 4050 Laptop GPU | 15.6"" FHD IPS 144Hz Display | 16GB DDR5 | 512GB Gen 4 SSD | WiFi 6 | Backlit KB | ANV15-51-73B9",2.0,4.3,https://www.amazon.com/i7-13620H-Processor-GeForce-Display-ANV15-51-73B9/dp/B0CMRGBXM9/ref=sr_1_5?dib=eyJ2IjoiMSJ9.9mcadjYfGkCGNRSpf4OtmOtT6vZeuAykrxBJYpx3QYQnEzOJMvaoSji36PofYWZ-jQ6zrTDyMEO1lGzw2VHMnAYXhs7kelZLHtGqca8-TmaKNCiiYUzJ2eCPTcrfD7aoeKlBktQzrSlHXSz_ojAPkW5SATgIMrhK9_K5wXE3ahkri20fBJeo4lGRM7jbdvWBzaxKqWbtl-ZBu75MxgasKNhKQL7wVRupNSPhLXva2j0OWexiZzIi1qHTdJ4g_tUrdY4l-O-VBUhr9XXY55aybAGC1lwN-RK3Bf0UKuvtRu0Vn9-b6odNa9Sup557xInGcGY_0HGHvGyJeiNGMNKskPZYBC1kHE6eSnIg2xhBKv5UfzDpAakwGUdgapoiMm3hmavuYjvYESIHx-MG-BbT6wC2Eip2cVaLOUrXXp6oKFOnXSq05kt2f2rYhakXqucu.zcc2b-jDv5aTB3JshWR0WyRbbu9T9jldAPBtUqXMxO4&dib_tag=se&keywords=gaming&qid=1738000800&sr=8-5,"About this item Beyond Performance: Empower your gaming and creativity with the Nitro V 15, combining a 13th Gen Intel Core i7-13620H processor with the NVIDIA GeForce RTX 4050 Laptop GPU Picture-Perfect. Furiously Fast: See your digital conquests unfold in vibrant Full HD on a 15.6"" screen, perfectly timed at a quick 144Hz refresh rate and a wide 16:9 aspect ratio providing 82.64% screen-to-body ratio. Internal Specifications: 16GB DDR5 Memory (2 DDR5 Slots Total, Maximum 32GB); 512GB PCIe Gen 4 SSD (2 x PCIe M.2 Slots) Stay Connected: Your gaming sanctuary is wherever you are. On the couch? Settle in with fast and stable Wi-Fi 6. Gaming cafe? Get an edge online with Gigabit Ethernet. No matter your location, Nitro V 15 ensures you're always in the driver's seat. Thunderbolt 4: With the powerful Thunderbolt 4 port, you have the trifecta of power charging and data transfer with bidirectional movement and video display in one interface. Chilled to Perfection: Keep your cool amidst the fiercest gaming galaxies, thanks to Nitro V 15's innovative dual fans and effective exhaust system. Always Be Heard and Seen: Experience crystal clear communication with AI-powered Acer PurifiedView and PurifiedVoice noise reduction technology. You'll feel like you're in the command center of a spaceship, with pinpoint sound accuracy giving you the edge in your gaming skirmishes. No Limits with NitroSense: Channel your inner gaming strategist with the NitroSense utility app. Fine-tune your gaming setup to match your style, be it adjusting fan speeds for those heated battles or customizing lighting for immersive exploration Ports For All Your Accessories: 1 - USB Type-C Port USB 3.2 Gen 2 (up to 10 Gbps) DisplayPort over USB Type-C, Thunderbolt 4 & USB Charging, 1 - USB 3.2 Gen 2 Port (Featuring Power-off Charging), 2 - USB 3.2 Gen 1 ports, 1 - HDMI 2.1 Port with HDCP support, 1 - Headphone/Speaker/Line-out Jack, 1 - Ethernet (RJ-45), DC-in for AC adapter The Right Fit: 14.26"" W x 9.44"" D x 0.93/1.06"" H; 4.66 lbs.; One-Year International Travelers Limited Warranty (ITW) Show more › See more product details"
"Roblox Digital Gift Card - 1,000 Robux [Includes Exclusive Virtual Item] [Online Game Code]",10.0,4.4,https://www.amazon.com/Robux-Roblox-Online-Game-Code/dp/B07RZ74VLR/ref=sr_1_6?dib=eyJ2IjoiMSJ9.9mcadjYfGkCGNRSpf4OtmOtT6vZeuAykrxBJYpx3QYQnEzOJMvaoSji36PofYWZ-jQ6zrTDyMEO1lGzw2VHMnAYXhs7kelZLHtGqca8-TmaKNCiiYUzJ2eCPTcrfD7aoeKlBktQzrSlHXSz_ojAPkW5SATgIMrhK9_K5wXE3ahkri20fBJeo4lGRM7jbdvWBzaxKqWbtl-ZBu75MxgasKNhKQL7wVRupNSPhLXva2j0OWexiZzIi1qHTdJ4g_tUrdY4l-O-VBUhr9XXY55aybAGC1lwN-RK3Bf0UKuvtRu0Vn9-b6odNa9Sup557xInGcGY_0HGHvGyJeiNGMNKskPZYBC1kHE6eSnIg2xhBKv5UfzDpAakwGUdgapoiMm3hmavuYjvYESIHx-MG-BbT6wC2Eip2cVaLOUrXXp6oKFOnXSq05kt2f2rYhakXqucu.zcc2b-jDv5aTB3JshWR0WyRbbu9T9jldAPBtUqXMxO4&dib_tag=se&keywords=gaming&qid=1738000800&sr=8-6,"About this item Get a virtual item when you redeem a Robux digital code! Spend your Robux on new items for your avatar and additional perks in your favorite experiences. The ultimate gift for any Roblox fan. Discover millions of free experiences on Roblox. Explore, chat, and hang out with friends on your computer, phone, tablet, Xbox console, Oculus Rift, or HTC Vive. Note: This product grants Robux and can be redeemed by any user worldwide. It is not a standard Roblox Gift Card and cannot be used for a Roblox Premium purchase. Please allow up to 5 minutes for your balance to be updated after redeeming your code. › See more product details"
"Gaming Headset for PC, Ps4, Ps5, Xbox Headset with 7.1 Surround Sound, Gaming Headphones with Noise Cancelling Mic RGB Light Over Ear Headphones for Xbox Series X/S, Switch",24.99,4.5,https://www.amazon.com/Surround-Headphones-Cancelling-Flexible-Earmuffs/dp/B09TB15CTL/ref=sr_1_7?dib=eyJ2IjoiMSJ9.9mcadjYfGkCGNRSpf4OtmOtT6vZeuAykrxBJYpx3QYQnEzOJMvaoSji36PofYWZ-jQ6zrTDyMEO1lGzw2VHMnAYXhs7kelZLHtGqca8-TmaKNCiiYUzJ2eCPTcrfD7aoeKlBktQzrSlHXSz_ojAPkW5SATgIMrhK9_K5wXE3ahkri20fBJeo4lGRM7jbdvWBzaxKqWbtl-ZBu75MxgasKNhKQL7wVRupNSPhLXva2j0OWexiZzIi1qHTdJ4g_tUrdY4l-O-VBUhr9XXY55aybAGC1lwN-RK3Bf0UKuvtRu0Vn9-b6odNa9Sup557xInGcGY_0HGHvGyJeiNGMNKskPZYBC1kHE6eSnIg2xhBKv5UfzDpAakwGUdgapoiMm3hmavuYjvYESIHx-MG-BbT6wC2Eip2cVaLOUrXXp6oKFOnXSq05kt2f2rYhakXqucu.zcc2b-jDv5aTB3JshWR0WyRbbu9T9jldAPBtUqXMxO4&dib_tag=se&keywords=gaming&qid=1738000800&sr=8-7,"About this item Superb 7.1 Surround Sound - Featuring a high-precision 50mm magnetic neodymium driver to create an immersive gaming experience with stereo surround sound in gaming headset for incredibly realistic sound. Cool style gaming experience - Colorful Led lights create a gorgeous game atmosphere, enhances your immersive gaming experience. Perfect for most FPS games like God of war, Fortnite, PUBG or CS: GO. Great Humanized Design - Comfortable and breathable permeability protein over-ear pads perfectly on your head, providing you with superior comfort during hours of gaming. The adjustable headband is very suitable for all gaming players of all ages. Gaming Platform Compatibility - This gaming headset support Ps5, Ps4, New Xbox, Xbox Series X/S, Switch, PC, Laptop, iOS, Mobile Phone and other devices with 3.5mm jack. Please note you need an extra Microsoft Adapter (Not Included) when connect with an old version Xbox One controller. Sensitivity Noise-Cancelling Microphone - 360° omnidirectionally rotatable sensitive microphone, premium noise cancellation, sound localisation, reduces distracting background noise to picks up your voice clearly to ensure your commands are always heard. *Note 1: When you use headset on your PC, be sure to connect the ""1-to-2 3.5mm audio jack splitter cable"" (Red-Mic, Green-audio). *Note 2: When your devices have a USB socket, the RGB lights can light up. The usb connector is only for led light power. › See more product details"
"2025 Gaming Laptop, Laptop with AMD Ryzen 7 5825U (8C/16T, Up to 4.5GHz), 16GB RAM 512GB NVMe SSD Laptop Computer, Radeon RX Vega 8 Graphics, 16.1-inch FHD Display, WiFi 6, 53Wh Battery, Backlit KB",2.0,4.4,https://www.amazon.com/Computer-Graphics-16-1-inch-Display-Battery/dp/B0DR8859K6/ref=sr_1_8?dib=eyJ2IjoiMSJ9.9mcadjYfGkCGNRSpf4OtmOtT6vZeuAykrxBJYpx3QYQnEzOJMvaoSji36PofYWZ-jQ6zrTDyMEO1lGzw2VHMnAYXhs7kelZLHtGqca8-TmaKNCiiYUzJ2eCPTcrfD7aoeKlBktQzrSlHXSz_ojAPkW5SATgIMrhK9_K5wXE3ahkri20fBJeo4lGRM7jbdvWBzaxKqWbtl-ZBu75MxgasKNhKQL7wVRupNSPhLXva2j0OWexiZzIi1qHTdJ4g_tUrdY4l-O-VBUhr9XXY55aybAGC1lwN-RK3Bf0UKuvtRu0Vn9-b6odNa9Sup557xInGcGY_0HGHvGyJeiNGMNKskPZYBC1kHE6eSnIg2xhBKv5UfzDpAakwGUdgapoiMm3hmavuYjvYESIHx-MG-BbT6wC2Eip2cVaLOUrXXp6oKFOnXSq05kt2f2rYhakXqucu.zcc2b-jDv5aTB3JshWR0WyRbbu9T9jldAPBtUqXMxO4&dib_tag=se&keywords=gaming&qid=1738000800&sr=8-8,"About this item 【Enhanced Gaming Experience】The KAIGERR 2024 AX16PRO gaming laptop is equipped with the powerful AMD Ryzen 7 5825U processor (8C/16T, up to 4.3GHz), delivering superior performance and responsiveness. This upgraded hardware ensures smooth gameplay, fast loading times, and high-quality visuals. It provides an immersive, lag-free gaming experience that brings your favorite titles to life. 【16.1"" High-Definition IPS Screen】With its wide color gamut and high refresh rate, this laptop delivers smoother visuals and sharper detail, offering a more vivid and accurate representation than standard displays. This enhanced clarity brings a stunning and immersive visual experience, making every scene more dynamic. 【Upgradeable Storage Capacity】This laptop computer comes with 16GB of DDR4 RAM and a 512GB M.2 NVMe SSD, ensuring faster response times and ample storage for your files. The dual-channel DDR4 memory can be upgraded to 64GB (2x32GB), while the NVMe/NGFF SSD supports expansion up to 2TB. With this level of upgradeability, you'll have more than enough space to store all your favorite games and handle even the most demanding tasks with ease. 【Extensive & Premium Connectivity】Designed for ultra-fast gaming, KAIGERR windows laptop is equipped with webcam × 1, USB 3.2 × 2, HDMI × 1, Type_C (full function) × 1, 3.5mm audio/microphone × 1, TF card holder × 1, Type_C DC jack × 1. Enjoy higher speeds with Wi-Fi 6, compatible with the 802.11ax standard and up to 3x faster than Wi-Fi 5. Paired with the backlit keyboard, it helps you be more immersed in the game world. 【KAIGERR: Quality Laptops, Exceptional Support.】Enjoy peace of mind with unlimited technical support and 12 months of repair for all customers, with our team always ready to help. If you have any questions or concerns, feel free to reach out to us—we’re here to help. › See more product details"
"Sceptre Curved 24.5-inch Gaming Monitor up to 240Hz 1080p R1500 1ms DisplayPort x2 HDMI x2 Blue Light Shift Build-in Speakers, Machine Black 2023 (C255B-FWT240)",129.97,4.4,https://www.amazon.com/Sceptre-24-5-inch-DisplayPort-Speakers-C255B-FWT240/dp/B0BTKJFRDV/ref=sr_1_9?dib=eyJ2IjoiMSJ9.9mcadjYfGkCGNRSpf4OtmOtT6vZeuAykrxBJYpx3QYQnEzOJMvaoSji36PofYWZ-jQ6zrTDyMEO1lGzw2VHMnAYXhs7kelZLHtGqca8-TmaKNCiiYUzJ2eCPTcrfD7aoeKlBktQzrSlHXSz_ojAPkW5SATgIMrhK9_K5wXE3ahkri20fBJeo4lGRM7jbdvWBzaxKqWbtl-ZBu75MxgasKNhKQL7wVRupNSPhLXva2j0OWexiZzIi1qHTdJ4g_tUrdY4l-O-VBUhr9XXY55aybAGC1lwN-RK3Bf0UKuvtRu0Vn9-b6odNa9Sup557xInGcGY_0HGHvGyJeiNGMNKskPZYBC1kHE6eSnIg2xhBKv5UfzDpAakwGUdgapoiMm3hmavuYjvYESIHx-MG-BbT6wC2Eip2cVaLOUrXXp6oKFOnXSq05kt2f2rYhakXqucu.zcc2b-jDv5aTB3JshWR0WyRbbu9T9jldAPBtUqXMxO4&dib_tag=se&keywords=gaming&qid=1738000800&sr=8-9,"About this item 240Hz Refresh Rate: Stay above the pack with 240Hz, giving you an edge in performance as frames transition instantly.Specific uses for product - Gaming 1ms Response Time: Colors fade and illuminate instantly with a 1ms response time, eliminating ghosting and piecing together precise imagery during action-packed scenes and gaming. 1500R Curvature: The 1500R degree curved design immerses you into all of the action no matter where you choose to sit in the room. AMD FreeSync Premium: By accelerating the frame rate to at least 120Hz at 1080P FHD resolution and delivering low latency to prevent visible delay in data processing, AMD FreeSync Premium allows gameplay to reach the highest echelons of performance. Built-In Speakers: Perfectly suited to work & gaming settings, built-in speakers deliver robust & smooth audio while saving space on your desk. › See more product details"
Abstract Topographic Map White Grey Black Gaming Mouse Pad Long Mouse Pad Large Desk Mat 31.5 X 11.8 Inch Mousepad with Non-Slip Base Stitched Edge Keyboard Mat for Gaming Office,9.9,4.5,https://www.amazon.com/Abstract-Topographic-Mousepad-Non-Slip-Stitched/dp/B0C5Q653LF/ref=sr_1_10?dib=eyJ2IjoiMSJ9.9mcadjYfGkCGNRSpf4OtmOtT6vZeuAykrxBJYpx3QYQnEzOJMvaoSji36PofYWZ-jQ6zrTDyMEO1lGzw2VHMnAYXhs7kelZLHtGqca8-TmaKNCiiYUzJ2eCPTcrfD7aoeKlBktQzrSlHXSz_ojAPkW5SATgIMrhK9_K5wXE3ahkri20fBJeo4lGRM7jbdvWBzaxKqWbtl-ZBu75MxgasKNhKQL7wVRupNSPhLXva2j0OWexiZzIi1qHTdJ4g_tUrdY4l-O-VBUhr9XXY55aybAGC1lwN-RK3Bf0UKuvtRu0Vn9-b6odNa9Sup557xInGcGY_0HGHvGyJeiNGMNKskPZYBC1kHE6eSnIg2xhBKv5UfzDpAakwGUdgapoiMm3hmavuYjvYESIHx-MG-BbT6wC2Eip2cVaLOUrXXp6oKFOnXSq05kt2f2rYhakXqucu.zcc2b-jDv5aTB3JshWR0WyRbbu9T9jldAPBtUqXMxO4&dib_tag=se&keywords=gaming&qid=1738000800&sr=8-10,"About this item 【Material and Quality】This large mouse pad are made of rubber. The surface is image printing and very smooth. The image quality is awesome. 【Packaged】This long mouse pad is rolled up and packaged instead of folded in half, so there will be no creases and bumps. 【Extended Size】31.5×11.8×0.12 inches( 800mm x 300mm x 3mm) gaming mouse pad covers a wide desk area to accommodate your mouse and keyboard, It's a wonderful size. You can get so many compliments at work and gaming! 【Easy to Clean】This oversized desk mat protects your desktop from drinks, ink, spilled water, and other liquid. If your mouse pad is dirty, you can wash it with clean water and let it dry. 【Why Choose Us】This Mouse Pad is Beautifully designed and made, premium feel, is much more snag-less than some other nylon mousepads, and tracking across it is great. You can give it to your family, friends, classmates, colleague, or lovers as a gift. › See more product details"
"Xbox Core Wireless Gaming Controller – Deep Pink Series X|S, One, Windows PC, Android, and iOS",52.99,4.6,https://www.amazon.com/Xbox-Core-Wireless-Controller-Deep-Controllers/dp/B09VV5LJS1/ref=sr_1_11?dib=eyJ2IjoiMSJ9.9mcadjYfGkCGNRSpf4OtmOtT6vZeuAykrxBJYpx3QYQnEzOJMvaoSji36PofYWZ-jQ6zrTDyMEO1lGzw2VHMnAYXhs7kelZLHtGqca8-TmaKNCiiYUzJ2eCPTcrfD7aoeKlBktQzrSlHXSz_ojAPkW5SATgIMrhK9_K5wXE3ahkri20fBJeo4lGRM7jbdvWBzaxKqWbtl-ZBu75MxgasKNhKQL7wVRupNSPhLXva2j0OWexiZzIi1qHTdJ4g_tUrdY4l-O-VBUhr9XXY55aybAGC1lwN-RK3Bf0UKuvtRu0Vn9-b6odNa9Sup557xInGcGY_0HGHvGyJeiNGMNKskPZYBC1kHE6eSnIg2xhBKv5UfzDpAakwGUdgapoiMm3hmavuYjvYESIHx-MG-BbT6wC2Eip2cVaLOUrXXp6oKFOnXSq05kt2f2rYhakXqucu.zcc2b-jDv5aTB3JshWR0WyRbbu9T9jldAPBtUqXMxO4&dib_tag=se&keywords=gaming&qid=1738000800&sr=8-11,"About this item XBOX DEEP PINK WIRELESS CONTROLLER: Experience the modernized design of the Xbox Wireless Controller, featuring sculpted surfaces and refined geometry for enhanced comfort during gameplay with battery life up to 40 hours.* STAY ON TARGET: New hybrid D-pad and textured grip on the triggers, bumpers, and back-case. SHARE BUTTON: Seamlessly capture and share content such as screenshots, recordings, and more with the new Share button. PLAY ACROSS DEVICES: Includes Xbox Wireless and Bluetooth technology so you can easily pair and switch between devices including Xbox Series X, Xbox Series S, Xbox One, Windows PC, Android, and iOS.* COMPATIBILITY: Plug in any compatible headset with the 3.5mm audio headset jack. Connect using the USB-C port for direct plug and play to console or PC.* CUSTOM BUTTON MAPPING: Make the controller your own by customizing button mappings with the Xbox Accessories app.* › See more product details"
