Title,Price,Rating,Link,Description
"3-in-1 PC Gaming Headset&Controller Holder - EURPMASK Headphone Stand w/Adjustable Clamp&2 Controller Holder&Rotating Arm&Cable Organizer, Universal PC Gaming Accessory Controller Headset Stand-Black",19.99,4.5,https://www.amazon.com/Gaming-Headphone-Controller-Holder-Organizer-Black/dp/B0BPSP3BQH/ref=sr_1_17?dib=eyJ2IjoiMSJ9.Vcl_jVwa4EZtxVhO1eHARrCbTWr8Dx3Qrfko5eNeKldW6wD05J6DrEU1RatlxlyE6MLkwGcgTu4sli-20WEKB0DvEaSJ3VXI0OSmqlmWx8u7O1Kr4TQWm1EjD7jmlok3ZokYS3yj5WvrcnDRrdp1aMghMdZGjXxksYJfJ3fz-cmriSofCltaGcbeGZ3EcDRn7tEfcLNzRogYU5KBsAHuoNzxLxEjv6HOouAVH0mYe9bHfoRQDzlXCCpHtz4igwaxOEuztPJ_TlxPTViwe0Ty-9tzEKvwkjo7zzCKdGDOLwfH2M4SD9TIWm--B6pq0qtMteTFYQ1RzVKPvjXMxhRFr5M3CsJbhR7I9F1QXJHxOEJBMFz8s_aLNg_KefkhHry3Hmb5h2zjR3BHUwxH9gngK3z4SUklwcc1Dx9B9U-vCcchNJ7SaH3Hi_rLNfdZVRhQ.5tY8fpWcf4edFAhwoLOAXQ0uVftHvMkRItWVSfJsaCI&dib_tag=se&keywords=gaming&qid=1738335401&sr=8-17,"About this item Dual Controller Holder &1 Headphone Hanger - Eurpmask 3-in-1 stand features a 360 degree rotating hook and 2 detachable holder to hold 2 game controllers and a headphone simultaneously. It fits all kinds of gaming controllers under 2.2 lbs(1 kg), likePS5/PS4, Xbox One, 360, Xbox Series X , Switch Pro, Steam controller and other PC gamepads. Elegant black finish fits various style of your gaming area and workstation. Convenient Storage - Storing your headset and controllers under desk means you get an ideal solution for narrow space. Keep your frequently used devices within arm reach and make your desk space clutter free. Cable Clip for Organization - A little cable clip keeps headphone cables from dragging on the floor or getting tangled up under desk. It enables you to fold cables and hold them on the side. Spring Loaded Clamp - Easy to open the clamp and secure it on your desk edge. The adjustable range of clamp is from 0.31 inch(8mm) to 1.57 inches(40mm) that allows you attach this stand on anywhere you need, instead of permanent adhesive. Protective Rubber Pads - There are rubber pads on the clamp and controller holder to avoid this holder moving around your desk and protect your devices from scratches. › See more product details"
"Exquisite Gaming: Call of Duty: Monkeybomb - Original Mobile Phone & Gaming Controller Holder, Device Stand, Cable Guys, Licensed Figure",24.69,4.8,https://www.amazon.com/Exquisite-Gaming-Cable-Guys-Controller/dp/B08KJJFFY8/ref=sr_1_18?dib=eyJ2IjoiMSJ9.Vcl_jVwa4EZtxVhO1eHARrCbTWr8Dx3Qrfko5eNeKldW6wD05J6DrEU1RatlxlyE6MLkwGcgTu4sli-20WEKB0DvEaSJ3VXI0OSmqlmWx8u7O1Kr4TQWm1EjD7jmlok3ZokYS3yj5WvrcnDRrdp1aMghMdZGjXxksYJfJ3fz-cmriSofCltaGcbeGZ3EcDRn7tEfcLNzRogYU5KBsAHuoNzxLxEjv6HOouAVH0mYe9bHfoRQDzlXCCpHtz4igwaxOEuztPJ_TlxPTViwe0Ty-9tzEKvwkjo7zzCKdGDOLwfH2M4SD9TIWm--B6pq0qtMteTFYQ1RzVKPvjXMxhRFr5M3CsJbhR7I9F1QXJHxOEJBMFz8s_aLNg_KefkhHry3Hmb5h2zjR3BHUwxH9gngK3z4SUklwcc1Dx9B9U-vCcchNJ7SaH3Hi_rLNfdZVRhQ.5tY8fpWcf4edFAhwoLOAXQ0uVftHvMkRItWVSfJsaCI&dib_tag=se&keywords=gaming&qid=1738335401&sr=8-18,"About this item MONKEYBOMB: Be careful - and don’t throw him, as he just might vaporize before your eyes. 8.5"" FIGURE: Heavy duty PVC statue and sturdy base that holds your stuff without tipping over. VERSATILE: Easily holds and displays most hand-held electronics, business cards, TV remotes, eBook readers, etc! GREAT GIFT IDEA: Calling all Call of Duty fans, this is a collectible figure must-have gift. An essential for any COD gamer. OFFICIALLY LICENSED: Your favorite pop culture characters - With A Purpose! Officially licensed by Activision - Call of Duty, styled on Monkey Bomb. › See more product details"
"Razer BlackShark V2 X Gaming Headset: 7.1 Surround Sound - 50mm Drivers - Memory Foam Cushion - For PC, PS4, PS5, Switch - 3.5mm Audio Jack - Black",39.99,4.4,https://www.amazon.com/Razer-BlackShark-V2-Gaming-Headset/dp/B086PKMZ21/ref=sr_1_19?dib=eyJ2IjoiMSJ9.Vcl_jVwa4EZtxVhO1eHARrCbTWr8Dx3Qrfko5eNeKldW6wD05J6DrEU1RatlxlyE6MLkwGcgTu4sli-20WEKB0DvEaSJ3VXI0OSmqlmWx8u7O1Kr4TQWm1EjD7jmlok3ZokYS3yj5WvrcnDRrdp1aMghMdZGjXxksYJfJ3fz-cmriSofCltaGcbeGZ3EcDRn7tEfcLNzRogYU5KBsAHuoNzxLxEjv6HOouAVH0mYe9bHfoRQDzlXCCpHtz4igwaxOEuztPJ_TlxPTViwe0Ty-9tzEKvwkjo7zzCKdGDOLwfH2M4SD9TIWm--B6pq0qtMteTFYQ1RzVKPvjXMxhRFr5M3CsJbhR7I9F1QXJHxOEJBMFz8s_aLNg_KefkhHry3Hmb5h2zjR3BHUwxH9gngK3z4SUklwcc1Dx9B9U-vCcchNJ7SaH3Hi_rLNfdZVRhQ.5tY8fpWcf4edFAhwoLOAXQ0uVftHvMkRItWVSfJsaCI&dib_tag=se&keywords=gaming&qid=1738335401&sr=8-19,"About this item ADVANCED PASSIVE NOISE CANCELLATION — sturdy closed earcups fully cover ears to prevent noise from leaking into the headset, with its cushions providing a closer seal for more sound isolation. 7.1 SURROUND SOUND FOR POSITIONAL AUDIO — Outfitted with custom-tuned 50 mm drivers, capable of software-enabled surround sound. *Only available on Windows 10 64-bit TRIFORCE TITANIUM 50MM HIGH-END SOUND DRIVERS — With titanium-coated diaphragms for added clarity, our new, cutting-edge proprietary design divides the driver into 3 parts for the individual tuning of highs, mids, and lowsproducing brighter, clearer audio with richer highs and more powerful lows LIGHTWEIGHT DESIGN WITH BREATHABLE FOAM EAR CUSHIONS — At just 240g, the BlackShark V2X is engineered from the ground up for maximum comfort RAZER HYPERCLEAR CARDIOID MIC — Improved pickup pattern ensures more voice and less noise as it tapers off towards the mic’s back and sides CROSS-PLATFORM COMPATIBILITY — Works with PC, Mac, PS4, Xbox One, Nintendo Switch via 3.5mm jack, enjoy unfair audio advantage across almost every platform. *Xbox One stereo adapter may be required, purchase separately #1 SELLING PC GAMING PERIPHERALS BRAND IN THE U.S. — Source — Circana, Retail Tracking Service, U.S., Dollar Sales, Gaming Designed Mice, Keyboards, and PC Headsets, Jan. 2019- Dec. 2023 combined › See more product details"
"YPBDAN Wireless Gaming Headset for PS5, PS4, PC, USB Over Ear Gaming Headphones with Noise Canceling Mic, Bluetooth 5.3, 100H Battery, Low Latency, Foldable Headset for Switch, Mac, Laptop",34.99,4.9,https://www.amazon.com/Wireless-PC-Headphones-Canceling-Bluetooth-Foldable/dp/B0DM9598RQ/ref=sr_1_20?dib=eyJ2IjoiMSJ9.Vcl_jVwa4EZtxVhO1eHARrCbTWr8Dx3Qrfko5eNeKldW6wD05J6DrEU1RatlxlyE6MLkwGcgTu4sli-20WEKB0DvEaSJ3VXI0OSmqlmWx8u7O1Kr4TQWm1EjD7jmlok3ZokYS3yj5WvrcnDRrdp1aMghMdZGjXxksYJfJ3fz-cmriSofCltaGcbeGZ3EcDRn7tEfcLNzRogYU5KBsAHuoNzxLxEjv6HOouAVH0mYe9bHfoRQDzlXCCpHtz4igwaxOEuztPJ_TlxPTViwe0Ty-9tzEKvwkjo7zzCKdGDOLwfH2M4SD9TIWm--B6pq0qtMteTFYQ1RzVKPvjXMxhRFr5M3CsJbhR7I9F1QXJHxOEJBMFz8s_aLNg_KefkhHry3Hmb5h2zjR3BHUwxH9gngK3z4SUklwcc1Dx9B9U-vCcchNJ7SaH3Hi_rLNfdZVRhQ.5tY8fpWcf4edFAhwoLOAXQ0uVftHvMkRItWVSfJsaCI&dib_tag=se&keywords=gaming&qid=1738335401&sr=8-20,"3-in-1 Connection Mode: Experience ultimate gaming immersion with the YP-1 Wireless Gaming Headset, designed for compatibility across various devices. ①. Enjoy wireless connectivity for PCs, PS4, PS5, and laptops via the 2.4GHz receiver. ②. Connect to Mac, Switch, and mobile devices using Bluetooth 5.3 (please note that Bluetooth does not support PS5 or PS4). ③. For Xbox One, Xbox Series, or any devices with a 3.5mm port, only the wired mode is supported. Long Battery Life & Low Latency: Enjoy extended gaming sessions without interruptions, powered by an impressive 1200mAh battery capacity. This robust battery allows for up to 100 hours of continuous gameplay on your favorite titles, unlocking new levels of excitement. With our low latency feature, experience video and audio without sync issues, enhancing your overall user experience. (Tip: Use USB-C for a full charge in just 2.5 hours; expect 100+ hours of gameplay without lighting and 25-30 hours in lighting modes.) Foldable Design & On-ear Function Control: Our foldable headphones are designed for ultimate convenience, easily fitting into any bag or backpack. This compact design is perfect for commuting, traveling, or working out, allowing you to enjoy your music or calls on the go. With user-friendly on-ear controls, switching between 2.4G/BT modes, adjusting effect light, and managing volume is a breeze! The setup includes an indicator light, charging port, 3.5mm jack, and microphone port for easy portability, so you can stay focused on your games without distractions. Superior Sound Quality: Dive into the game with our 50mm speakers and advanced surround sound technology. Capture every nuance and immerse yourself in lifelike sound effects! The noise-canceling microphone ensures crystal-clear communication with your teammates, fostering seamless teamwork during those high-octane gaming sessions. Fantastic Humanized Design with Premium Materials: Crafted for superior comfort, our headphones feature luxurious air protein over-ear pads that make those long gaming sessions a breeze! Lightweight and durable, these headphones ensure comfort during extended use, without sacrificing sound quality. Tips: Please note that the Bluetooth function is not compatible with PC, PS4, or PS5 directly. Also, only the 3.5mm wired mode is compatible with Xbox Series. Make sure to check your setup for the best experience! › See more product details"
"Sceptre 30-inch Curved Gaming Monitor 21:9 2560x1080 Ultra Wide/ Slim HDMI DisplayPort up to 200Hz Build-in Speakers, Metal Black (C305B-200UN1)",169.97,4.5,https://www.amazon.com/Sceptre-30-inch-Curved-Gaming-Monitor/dp/B07TXM7K4T/ref=sr_1_21?dib=eyJ2IjoiMSJ9.Vcl_jVwa4EZtxVhO1eHARrCbTWr8Dx3Qrfko5eNeKldW6wD05J6DrEU1RatlxlyE6MLkwGcgTu4sli-20WEKB0DvEaSJ3VXI0OSmqlmWx8u7O1Kr4TQWm1EjD7jmlok3ZokYS3yj5WvrcnDRrdp1aMghMdZGjXxksYJfJ3fz-cmriSofCltaGcbeGZ3EcDRn7tEfcLNzRogYU5KBsAHuoNzxLxEjv6HOouAVH0mYe9bHfoRQDzlXCCpHtz4igwaxOEuztPJ_TlxPTViwe0Ty-9tzEKvwkjo7zzCKdGDOLwfH2M4SD9TIWm--B6pq0qtMteTFYQ1RzVKPvjXMxhRFr5M3CsJbhR7I9F1QXJHxOEJBMFz8s_aLNg_KefkhHry3Hmb5h2zjR3BHUwxH9gngK3z4SUklwcc1Dx9B9U-vCcchNJ7SaH3Hi_rLNfdZVRhQ.5tY8fpWcf4edFAhwoLOAXQ0uVftHvMkRItWVSfJsaCI&dib_tag=se&keywords=gaming&qid=1738335401&sr=8-21,"About this item 30"" Curved Gaming Monitor 2560 x 1080 Full HD Resolution. Response Time- 5ms GTG.Aspect Ratio: 21:9. Viewing Angle is 170° (H) / 170° (V). Brightness(typ) is 250. Without Stand (W x H x D)-27.82 x 12.64 x 3.69 inches DP Up to 200Hz Refresh Rate / HDMI 2. 0 Up to 120Hz Refresh Rate: More than double the standard refresh rate, 200Hz gives gamers an edge in visibility as frames transition instantly, leaving behind no blurred images AMD Free Sync With Free Sync, gamers now enjoy smooth video and seamless on the spot movement through their fast paced games. Free Sync is an AMD technology that nearly eliminates tearing and stuttering due to differences between a graphics card's frame rate and a monitor's refresh rate. FPS-RTS FPS and RTS are Scepter's custom set display settings built for an enhanced gaming experience. FPS (First Person Shooter) , RTS (Real-Time Strategy). Blue Light Shift Reduce your monitors blue light to protect you from eye fatigue, irritation and strains. This enables you to work on you documents, watch movies, or play games more comfortably for extended periods. Gaming LED Light VESA Wall Mount Pattern Using the VESA wall mount pattern, easily mount your Scepter LED monitor on the wall in a manner that is both aesthetically pleasing and conveniently practical. You will be able to save ample space and view the screen in a position that affords the greatest visibility possible. Built-in Speakers With built-in speakers, the monitor delivers office level audio for conference calls and internet workshops. Similarly, enjoy engaging audio while listening to your favorite tunes. Thin Bezel Savor every inch of the large screen as the bezel is a mere . 80 cm wide. Anti-Flicker Provides a crisper picture by preventing the backlight from flickering periodically Show more › See more product details"
"Acer Nitro V Gaming Laptop | Intel Core i5-13420H Processor | NVIDIA GeForce RTX 4050 Laptop GPU | 15.6"" FHD IPS 144Hz Display | 8GB DDR5 | 512GB Gen 4 SSD | WiFi 6 | Backlit KB | ANV15-51-51H9",679.99,4.3,https://www.amazon.com/i5-13420H-Processor-GeForce-Display-ANV15-51-51H9/dp/B0CP8D4SM2/ref=sr_1_22?dib=eyJ2IjoiMSJ9.Vcl_jVwa4EZtxVhO1eHARrCbTWr8Dx3Qrfko5eNeKldW6wD05J6DrEU1RatlxlyE6MLkwGcgTu4sli-20WEKB0DvEaSJ3VXI0OSmqlmWx8u7O1Kr4TQWm1EjD7jmlok3ZokYS3yj5WvrcnDRrdp1aMghMdZGjXxksYJfJ3fz-cmriSofCltaGcbeGZ3EcDRn7tEfcLNzRogYU5KBsAHuoNzxLxEjv6HOouAVH0mYe9bHfoRQDzlXCCpHtz4igwaxOEuztPJ_TlxPTViwe0Ty-9tzEKvwkjo7zzCKdGDOLwfH2M4SD9TIWm--B6pq0qtMteTFYQ1RzVKPvjXMxhRFr5M3CsJbhR7I9F1QXJHxOEJBMFz8s_aLNg_KefkhHry3Hmb5h2zjR3BHUwxH9gngK3z4SUklwcc1Dx9B9U-vCcchNJ7SaH3Hi_rLNfdZVRhQ.5tY8fpWcf4edFAhwoLOAXQ0uVftHvMkRItWVSfJsaCI&dib_tag=se&keywords=gaming&qid=1738335401&sr=8-22,"About this item Beyond Performance: Empower your gaming and creativity with the Nitro V 15, combining a 13th Gen Intel Core i5-13420H processor with the NVIDIA GeForce RTX 4050 Laptop GPU Picture-Perfect. Furiously Fast: See your digital conquests unfold in vibrant Full HD on a 15.6"" screen, perfectly timed at a quick 144Hz refresh rate and a wide 16:9 aspect ratio providing 82.64% screen-to-body ratio. Stay Connected: Your gaming sanctuary is wherever you are. On the couch? Settle in with fast and stable Wi-Fi 6. Gaming cafe? Get an edge online with Gigabit Ethernet. No matter your location, Nitro V 15 ensures you're always in the driver's seat. Thunderbolt 4: With the powerful Thunderbolt 4 port, you have the trifecta of power charging and data transfer with bidirectional movement and video display in one interface. Chilled to Perfection: Keep your cool amidst the fiercest gaming galaxies, thanks to Nitro V 15's innovative dual fans and effective exhaust system. Always Be Heard and Seen: Experience crystal clear communication with AI-powered Acer PurifiedView and PurifiedVoice noise reduction technology. You'll feel like you're in the command center of a spaceship, with pinpoint sound accuracy giving you the edge in your gaming skirmishes. No Limits with NitroSense: Channel your inner gaming strategist with the NitroSense utility app. Fine-tune your gaming setup to match your style, be it adjusting fan speeds for those heated battles or customizing lighting for immersive exploration Ports For All Your Accessories: 1 - USB Type-C Port USB 3.2 Gen 2 (up to 10 Gbps) DisplayPort over USB Type-C, Thunderbolt 4 & USB Charging, 1 - USB 3.2 Gen 2 Port (Featuring Power-off Charging), 2 - USB 3.2 Gen 1 ports, 1 - HDMI 2.1 Port with HDCP support, 1 - Headphone/Speaker/Line-out Jack, 1 - Ethernet (RJ-45), DC-in for AC adapter The Right Fit: 14.26"" W x 9.44"" D x 0.93/1.06"" H; 4.66 lbs. Show more › See more product details"
"SteelSeries Arctis Nova Pro Wireless Multi-System Gaming Headset - Premium Hi-Fi Drivers - Active Noise Cancellation - Infinity Power System - ClearCast Gen 2 Mic - PS5, PS4, PC, Switch, Mobile",279.3,4.2,https://www.amazon.com/SteelSeries-Wireless-Multi-System-Headset-PlayStation-5/dp/B0CCXWH6WG/ref=sr_1_23?dib=eyJ2IjoiMSJ9.Vcl_jVwa4EZtxVhO1eHARrCbTWr8Dx3Qrfko5eNeKldW6wD05J6DrEU1RatlxlyE6MLkwGcgTu4sli-20WEKB0DvEaSJ3VXI0OSmqlmWx8u7O1Kr4TQWm1EjD7jmlok3ZokYS3yj5WvrcnDRrdp1aMghMdZGjXxksYJfJ3fz-cmriSofCltaGcbeGZ3EcDRn7tEfcLNzRogYU5KBsAHuoNzxLxEjv6HOouAVH0mYe9bHfoRQDzlXCCpHtz4igwaxOEuztPJ_TlxPTViwe0Ty-9tzEKvwkjo7zzCKdGDOLwfH2M4SD9TIWm--B6pq0qtMteTFYQ1RzVKPvjXMxhRFr5M3CsJbhR7I9F1QXJHxOEJBMFz8s_aLNg_KefkhHry3Hmb5h2zjR3BHUwxH9gngK3z4SUklwcc1Dx9B9U-vCcchNJ7SaH3Hi_rLNfdZVRhQ.5tY8fpWcf4edFAhwoLOAXQ0uVftHvMkRItWVSfJsaCI&dib_tag=se&keywords=gaming&qid=1738335401&sr=8-23,"About this item ALMIGHTY AUDIO - Experience ultimate clarity and sound clarity with Premium High Fidelity Drivers. Fully customize the sound experience with the Sonar Software by using a first-in-gaming Pro-grade Parametric EQ. 360° SPATIAL AUDIO - Immersive surround sound transports you to the gaming world, letting you hear every critical step, reload, or vocal cue to give you an advantage.*Fully compatible with Tempest 3D Audio for PS5 / Microsoft Spatial Sound ACTIVE NOISE CANCELLATION - Immerse yourself in your virtual world as a specialized 4-mic hybrid system designed for gaming tunes out ambient noise. Use Transparency Mode with variable levels to adapt to any situation. INFINITY POWER SYSTEM - Hot-swap between using one battery while charging the other to keep your headset going and going and going. MULTI-SYSTEM CONNECT - Twin USB ports let you connect your PlayStation, PC, Mac, or Switch, and swap between them with the press of a button. › See more product details"
"2.4GHz Wireless Gaming Headset for PC, Ps5, Ps4 - Lossless Audio USB & Type-C Ultra Stable Gaming Headphones with Flip Microphone, 40-Hr Battery Gamer Headset for Switch, Laptop, Mobile, Mac",29.99,4.5,https://www.amazon.com/Ozeino-2-4GHz-Wireless-Gaming-Headset/dp/B0C4F9JGTJ/ref=sr_1_24?dib=eyJ2IjoiMSJ9.Vcl_jVwa4EZtxVhO1eHARrCbTWr8Dx3Qrfko5eNeKldW6wD05J6DrEU1RatlxlyE6MLkwGcgTu4sli-20WEKB0DvEaSJ3VXI0OSmqlmWx8u7O1Kr4TQWm1EjD7jmlok3ZokYS3yj5WvrcnDRrdp1aMghMdZGjXxksYJfJ3fz-cmriSofCltaGcbeGZ3EcDRn7tEfcLNzRogYU5KBsAHuoNzxLxEjv6HOouAVH0mYe9bHfoRQDzlXCCpHtz4igwaxOEuztPJ_TlxPTViwe0Ty-9tzEKvwkjo7zzCKdGDOLwfH2M4SD9TIWm--B6pq0qtMteTFYQ1RzVKPvjXMxhRFr5M3CsJbhR7I9F1QXJHxOEJBMFz8s_aLNg_KefkhHry3Hmb5h2zjR3BHUwxH9gngK3z4SUklwcc1Dx9B9U-vCcchNJ7SaH3Hi_rLNfdZVRhQ.5tY8fpWcf4edFAhwoLOAXQ0uVftHvMkRItWVSfJsaCI&dib_tag=se&keywords=gaming&qid=1738335401&sr=8-24,"About this item 【Amazing Stable Connection-Quick Access to Games】Real-time gaming audio with our 2.4GHz USB & Type-C ultra-low latency wireless connection. With less than 30ms delay, you can enjoy smoother operation and stay ahead of the competition, so you can enjoy an immersive lag-free wireless gaming experience. 【Game Communication-Better Bass and Accuracy】The 50mm driver plus 2.4G lossless wireless transports you to the gaming world, letting you hear every critical step, reload, or vocal in Fortnite, Call of Duty, The Legend of Zelda and RPG, so you will never miss a step or shot during game playing. You will completely in awe with the range, precision, and audio quality your ears were experiencing. 【Flexible and Convenient Design-Effortless in Game】Ideal intuitive button layout on the headphones for user. Multi-functional button controls let you instantly crank or lower volume and mute, quickly answer phone calls, cut songs, turn on lights, etc. Ease of use and customization, are all done with passion and priority for the user. 【Less plug, More Play-Dual Input From 2.4GHz & Bluetooth】 Wireless gaming headset adopts high performance dual mode design. With a 2.4GHz USB dongle, which is super sturdy, lag＜30ms, perfectly made for gamers. Bluetooth mode only work for phone, laptop and switch. And 3.5mm wired mode (Only support music and call). 【Wide Compatibility with Gaming Devices】Setup the perfect entertainment system by plugging in 2.4G USB. The convenience of dual USB work seamlessly with your PS5,PS4, PC, Mac, Laptop, Switch and saves you from swapping cables. Bluetooth function can't directly support with Mac, Ps5, Ps4,Pc, additional USB Bluetooth Adapter is required (not included). Recommend to use the 2.4G mode, it easy and amazing connect. The 2 in 1 USB transmitter needs to be combined to connect for Ps/Ps2/Ps5/Ps4/PC/Laptop/Mac, can't be used separately. › See more product details"
"HP Victus 15.6 i5 Gaming Laptop, 15.6"" FHD 1920*1080 144Hz, Intel Core i5-12450H, NVIDIA GeForce RTX 3050, 32GB RAM, 1TB SSD, Backlit KB, Touchpad, SD Card Reader, Webcam, HDMI, Wi-Fi 6, W11 H, Blue",638.98,4.3,https://www.amazon.com/HP-i5-12450H-GeForce-Backlit-Touchpad/dp/B0D845LL5R/ref=sr_1_25?dib=eyJ2IjoiMSJ9.Vcl_jVwa4EZtxVhO1eHARrCbTWr8Dx3Qrfko5eNeKldW6wD05J6DrEU1RatlxlyE6MLkwGcgTu4sli-20WEKB0DvEaSJ3VXI0OSmqlmWx8u7O1Kr4TQWm1EjD7jmlok3ZokYS3yj5WvrcnDRrdp1aMghMdZGjXxksYJfJ3fz-cmriSofCltaGcbeGZ3EcDRn7tEfcLNzRogYU5KBsAHuoNzxLxEjv6HOouAVH0mYe9bHfoRQDzlXCCpHtz4igwaxOEuztPJ_TlxPTViwe0Ty-9tzEKvwkjo7zzCKdGDOLwfH2M4SD9TIWm--B6pq0qtMteTFYQ1RzVKPvjXMxhRFr5M3CsJbhR7I9F1QXJHxOEJBMFz8s_aLNg_KefkhHry3Hmb5h2zjR3BHUwxH9gngK3z4SUklwcc1Dx9B9U-vCcchNJ7SaH3Hi_rLNfdZVRhQ.5tY8fpWcf4edFAhwoLOAXQ0uVftHvMkRItWVSfJsaCI&dib_tag=se&keywords=gaming&qid=1738335401&sr=8-25,"About this item [High Speed RAM And Enormous Space] 32GB high-bandwidth RAM to smoothly run multiple applications and browser tabs all at once; 1TB PCIe NVMe M.2 Solid State Drive allows to fast bootup and data transfer [Processor] Intel Core i5-12450H Processor (8 Cores, 12 Threads, 12MB L3 Cache, Base Frequency at 1.5 GHz, Up to 4.4 GHz at Max Turbo Frequency), NVIDIA GeForce RTX 3050 (4 GB GDDR6) [Display] 15.6"" 144Hz FHD (1920 x 1080) anti-glare display, IPS panel, Micro-edge [Tech Specs] 1 x HDMI 2.1, 2 x USB Type-A (5Gbps signaling rate), 1 x RJ-45, 1 x USB Type-C (5Gbps signaling rate), 1 x Multi-format SD media card reader, 1 x Headphone/microphone combo, Touchpad, Backlit Keyboard, Webcam, Wi-Fi 6 [Operating System] Windows 11 Home - Beautiful, more consistent new design, Great window layout options, Improved performance features, New videogame selection and capabilities, Compatible with Android Apps › See more product details"
Large RGB Gaming Mouse Pad -15 Light Modes Touch Control Extended Soft Computer Keyboard Mat Non-Slip Rubber Base for Gamer Esports Pros 31.5X11.8 in,9.99,4.6,https://www.amazon.com/Extended-Computer-Keyboard-Non-Slip-31-5X11-8/dp/B09M3R13NQ/ref=sr_1_26?dib=eyJ2IjoiMSJ9.Vcl_jVwa4EZtxVhO1eHARrCbTWr8Dx3Qrfko5eNeKldW6wD05J6DrEU1RatlxlyE6MLkwGcgTu4sli-20WEKB0DvEaSJ3VXI0OSmqlmWx8u7O1Kr4TQWm1EjD7jmlok3ZokYS3yj5WvrcnDRrdp1aMghMdZGjXxksYJfJ3fz-cmriSofCltaGcbeGZ3EcDRn7tEfcLNzRogYU5KBsAHuoNzxLxEjv6HOouAVH0mYe9bHfoRQDzlXCCpHtz4igwaxOEuztPJ_TlxPTViwe0Ty-9tzEKvwkjo7zzCKdGDOLwfH2M4SD9TIWm--B6pq0qtMteTFYQ1RzVKPvjXMxhRFr5M3CsJbhR7I9F1QXJHxOEJBMFz8s_aLNg_KefkhHry3Hmb5h2zjR3BHUwxH9gngK3z4SUklwcc1Dx9B9U-vCcchNJ7SaH3Hi_rLNfdZVRhQ.5tY8fpWcf4edFAhwoLOAXQ0uVftHvMkRItWVSfJsaCI&dib_tag=se&keywords=gaming&qid=1738335401&sr=8-26,"About this item 【15 RGB LIGHT MODES & LARGE SIZE】This extra-thick RGB gaming mouse pad features 11 static light modes and 4 dynamic modes, the light is bright but not deter from viewing the monitor. The size of 31.5x11.8 inches fit your mouse and keyboard perfectly and still have a large amount of movement space. 【PLUG AND PLAY & TOUCH CONTROL】Powered by USB and no driver required. Unlike traditional click button, touch control button means more sensitive and quicker switch action and you never need to worry about click life span. 【NANO-TEXTURED CLOTH SURFACE】Nano-textured surface is softer and more smooth over micro-textured cloth to allow for lightning-fast mouse moving while maintaining accurate control even during intense use. 【HIGH QUALITY】Made of high elasticity natural rubber, this mouse mat is non-toxic and has no hazardous substances, safe for use. Anti-slip base can firmly grip your desktop and nylon stitched edges make the pad much more durable and longer lasting. Easily roll up the mouse pad without getting wrinkless or creases. 【45-DAY MONEY BACK & LIFETIME GURANTEE】We Stand Behind Our Quality! If for any reason you are not entirely happy, CONTACT US directly, we will replace or return your order with no question asked. BUY WITH 100% CONFIDENCE! › See more product details"
"ASUS TUF Gaming 27” 1440P HDR Monitor (VG27AQ3A) – QHD (2560 x 1440), 180Hz, 1ms, Fast IPS, 130% sRGB, Extreme Low Motion Blur Sync, Speakers, Freesync Premium, G-SYNC Compatible, HDMI, DisplayPort",199.0,4.5,https://www.amazon.com/ASUS-Gaming-1440P-Monitor-VG27AQ3A/dp/B0BZR9TMBJ/ref=sr_1_27?dib=eyJ2IjoiMSJ9.Vcl_jVwa4EZtxVhO1eHARrCbTWr8Dx3Qrfko5eNeKldW6wD05J6DrEU1RatlxlyE6MLkwGcgTu4sli-20WEKB0DvEaSJ3VXI0OSmqlmWx8u7O1Kr4TQWm1EjD7jmlok3ZokYS3yj5WvrcnDRrdp1aMghMdZGjXxksYJfJ3fz-cmriSofCltaGcbeGZ3EcDRn7tEfcLNzRogYU5KBsAHuoNzxLxEjv6HOouAVH0mYe9bHfoRQDzlXCCpHtz4igwaxOEuztPJ_TlxPTViwe0Ty-9tzEKvwkjo7zzCKdGDOLwfH2M4SD9TIWm--B6pq0qtMteTFYQ1RzVKPvjXMxhRFr5M3CsJbhR7I9F1QXJHxOEJBMFz8s_aLNg_KefkhHry3Hmb5h2zjR3BHUwxH9gngK3z4SUklwcc1Dx9B9U-vCcchNJ7SaH3Hi_rLNfdZVRhQ.5tY8fpWcf4edFAhwoLOAXQ0uVftHvMkRItWVSfJsaCI&dib_tag=se&keywords=gaming&qid=1738335401&sr=8-27,"About this item 27-inch QHD (2560 x 1440) gaming monitor with 180Hz refresh rate designed for professional gamers and immersive gameplay ASUS Extreme Low Motion Blur Sync (ELMB Sync) technology enables ELMB and variable-refresh-rate technologies to work simultaneously to eliminate ghosting and tearing for sharp gaming visuals with high frame rates FreeSync Premium, G-Sync compatible and AdaptiveSync technology delivers a seamless, tear-free gaming experience by enabling VRR (variable refresh rate) by default High Dynamic Range (HDR) technology supports HDR-10 format to enhance bright and dark areas What’s in the box: DisplayPort cable, L-shaped Screwdriver, Power cord, Power adapter, Quick start guide, Warranty Card 3-month Adobe Creative Cloud: Receive complimentary access with the purchase of this product (valid from 9/15/2021 to 8/31/2025) › See more product details"
