Title,Price,Rating,Link,Description
"Sceptre 30-inch Curved Gaming Monitor 21:9 2560x1080 Ultra Wide/ Slim HDMI DisplayPort up to 200Hz Build-in Speakers, Metal Black (C305B-200UN1)",169.97,4.5,https://www.amazon.com/Sceptre-30-inch-Curved-Gaming-Monitor/dp/B07TXM7K4T/ref=sr_1_23?dib=eyJ2IjoiMSJ9.9mcadjYfGkCGNRSpf4OtmOtT6vZeuAykrxBJYpx3QYQnEzOJMvaoSji36PofYWZ-jQ6zrTDyMEO1lGzw2VHMnAYXhs7kelZLHtGqca8-TmaKNCiiYUzJ2eCPTcrfD7aoeKlBktQzrSlHXSz_ojAPkW5SATgIMrhK9_K5wXE3ahkri20fBJeo4lGRM7jbdvWBzaxKqWbtl-ZBu75MxgasKNhKQL7wVRupNSPhLXva2j0OWexiZzIi1qHTdJ4g_tUrdY4l-O-VBUhr9XXY55aybAGC1lwN-RK3Bf0UKuvtRu0Vn9-b6odNa9Sup557xInGcGY_0HGHvGyJeiNGMNKskPZYBC1kHE6eSnIg2xhBKv5UfzDpAakwGUdgapoiMm3hmavuYjvYESIHx-MG-BbT6wC2Eip2cVaLOUrXXp6oKFOnXSq05kt2f2rYhakXqucu.zcc2b-jDv5aTB3JshWR0WyRbbu9T9jldAPBtUqXMxO4&dib_tag=se&keywords=gaming&qid=1738000800&sr=8-23,"About this item 30"" Curved Gaming Monitor 2560 x 1080 Full HD Resolution. Response Time- 5ms GTG.Aspect Ratio: 21:9. Viewing Angle is 170° (H) / 170° (V). Brightness(typ) is 250. Without Stand (W x H x D)-27.82 x 12.64 x 3.69 inches DP Up to 200Hz Refresh Rate / HDMI 2. 0 Up to 120Hz Refresh Rate: More than double the standard refresh rate, 200Hz gives gamers an edge in visibility as frames transition instantly, leaving behind no blurred images AMD Free Sync With Free Sync, gamers now enjoy smooth video and seamless on the spot movement through their fast paced games. Free Sync is an AMD technology that nearly eliminates tearing and stuttering due to differences between a graphics card's frame rate and a monitor's refresh rate. FPS-RTS FPS and RTS are Scepter's custom set display settings built for an enhanced gaming experience. FPS (First Person Shooter) , RTS (Real-Time Strategy). Blue Light Shift Reduce your monitors blue light to protect you from eye fatigue, irritation and strains. This enables you to work on you documents, watch movies, or play games more comfortably for extended periods. Gaming LED Light VESA Wall Mount Pattern Using the VESA wall mount pattern, easily mount your Scepter LED monitor on the wall in a manner that is both aesthetically pleasing and conveniently practical. You will be able to save ample space and view the screen in a position that affords the greatest visibility possible. Built-in Speakers With built-in speakers, the monitor delivers office level audio for conference calls and internet workshops. Similarly, enjoy engaging audio while listening to your favorite tunes. Thin Bezel Savor every inch of the large screen as the bezel is a mere . 80 cm wide. Anti-Flicker Provides a crisper picture by preventing the backlight from flickering periodically Show more › See more product details"
Large RGB Gaming Mouse Pad -15 Light Modes Touch Control Extended Soft Computer Keyboard Mat Non-Slip Rubber Base for Gamer Esports Pros 31.5X11.8 in,9.99,4.6,https://www.amazon.com/Extended-Computer-Keyboard-Non-Slip-31-5X11-8/dp/B09M3R13NQ/ref=sr_1_24?dib=eyJ2IjoiMSJ9.9mcadjYfGkCGNRSpf4OtmOtT6vZeuAykrxBJYpx3QYQnEzOJMvaoSji36PofYWZ-jQ6zrTDyMEO1lGzw2VHMnAYXhs7kelZLHtGqca8-TmaKNCiiYUzJ2eCPTcrfD7aoeKlBktQzrSlHXSz_ojAPkW5SATgIMrhK9_K5wXE3ahkri20fBJeo4lGRM7jbdvWBzaxKqWbtl-ZBu75MxgasKNhKQL7wVRupNSPhLXva2j0OWexiZzIi1qHTdJ4g_tUrdY4l-O-VBUhr9XXY55aybAGC1lwN-RK3Bf0UKuvtRu0Vn9-b6odNa9Sup557xInGcGY_0HGHvGyJeiNGMNKskPZYBC1kHE6eSnIg2xhBKv5UfzDpAakwGUdgapoiMm3hmavuYjvYESIHx-MG-BbT6wC2Eip2cVaLOUrXXp6oKFOnXSq05kt2f2rYhakXqucu.zcc2b-jDv5aTB3JshWR0WyRbbu9T9jldAPBtUqXMxO4&dib_tag=se&keywords=gaming&qid=1738000800&sr=8-24,"About this item 【15 RGB LIGHT MODES & LARGE SIZE】This extra-thick RGB gaming mouse pad features 11 static light modes and 4 dynamic modes, the light is bright but not deter from viewing the monitor. The size of 31.5x11.8 inches fit your mouse and keyboard perfectly and still have a large amount of movement space. 【PLUG AND PLAY & TOUCH CONTROL】Powered by USB and no driver required. Unlike traditional click button, touch control button means more sensitive and quicker switch action and you never need to worry about click life span. 【NANO-TEXTURED CLOTH SURFACE】Nano-textured surface is softer and more smooth over micro-textured cloth to allow for lightning-fast mouse moving while maintaining accurate control even during intense use. 【HIGH QUALITY】Made of high elasticity natural rubber, this mouse mat is non-toxic and has no hazardous substances, safe for use. Anti-slip base can firmly grip your desktop and nylon stitched edges make the pad much more durable and longer lasting. Easily roll up the mouse pad without getting wrinkless or creases. 【45-DAY MONEY BACK & LIFETIME GURANTEE】We Stand Behind Our Quality! If for any reason you are not entirely happy, CONTACT US directly, we will replace or return your order with no question asked. BUY WITH 100% CONFIDENCE! › See more product details"
"Redragon K585 DITI Wired One-Handed RGB Mechanical Gaming Keyboard, 42 Keys Type-C Professional Gaming Keypad w/Upgraded Hot-Swappable Socket, 7 Onboard Macro Keys & Detachable Wrist Rest",36.99,4.3,https://www.amazon.com/Redragon-K585-One-Handed-Mechanical-Professional/dp/B07NBJVH4G/ref=sr_1_25?dib=eyJ2IjoiMSJ9.9mcadjYfGkCGNRSpf4OtmOtT6vZeuAykrxBJYpx3QYQnEzOJMvaoSji36PofYWZ-jQ6zrTDyMEO1lGzw2VHMnAYXhs7kelZLHtGqca8-TmaKNCiiYUzJ2eCPTcrfD7aoeKlBktQzrSlHXSz_ojAPkW5SATgIMrhK9_K5wXE3ahkri20fBJeo4lGRM7jbdvWBzaxKqWbtl-ZBu75MxgasKNhKQL7wVRupNSPhLXva2j0OWexiZzIi1qHTdJ4g_tUrdY4l-O-VBUhr9XXY55aybAGC1lwN-RK3Bf0UKuvtRu0Vn9-b6odNa9Sup557xInGcGY_0HGHvGyJeiNGMNKskPZYBC1kHE6eSnIg2xhBKv5UfzDpAakwGUdgapoiMm3hmavuYjvYESIHx-MG-BbT6wC2Eip2cVaLOUrXXp6oKFOnXSq05kt2f2rYhakXqucu.zcc2b-jDv5aTB3JshWR0WyRbbu9T9jldAPBtUqXMxO4&dib_tag=se&keywords=gaming&qid=1738000800&sr=8-25,"About this item Slim and Tactical - The K585 keyboard gets rid of those extra keys and keeps the most useful ones in a slim & portable package. All of your keyboard action keys are in one convenient place. No need to worry about misclicked keys. Upgraded Hot-Swap - The upgraded socket is now available on Redragon one-handed keyboard, with more ways to mod, and more fun. The iconic Redragon Blue Switches deliver audible clicky with clear tactile feedback, original mechanical feel. Play to Win - With 7 programmable macro keys, binding multiple commands and activating them instantly is simple and quick. Assign single or multiple keystrokes to any macro key to save precious time in the middle of battle. Light it Up in Your Way - 5 RGB backlit modes are selectable with 16.8 Million Colors. Glorious & amazing lighting effects let the light of victory wreak havoc in the dark. USB Pass-Through Port - Positioned for uninterrupted game play and ready for your mouse, headset adapter, or other USB device. Form & Function - Ergonomically designed with a detachable wrist-rest section connected by magnets, the wrist-rest offers great support to make use more comfortable. › See more product details"
"Acer Nitro V Gaming Laptop | Intel Core i5-13420H Processor | NVIDIA GeForce RTX 4050 Laptop GPU | 15.6"" FHD IPS 144Hz Display | 8GB DDR5 | 512GB Gen 4 SSD | WiFi 6 | Backlit KB | ANV15-51-51H9",679.99,4.3,https://www.amazon.com/i5-13420H-Processor-GeForce-Display-ANV15-51-51H9/dp/B0CP8D4SM2/ref=sr_1_26?dib=eyJ2IjoiMSJ9.9mcadjYfGkCGNRSpf4OtmOtT6vZeuAykrxBJYpx3QYQnEzOJMvaoSji36PofYWZ-jQ6zrTDyMEO1lGzw2VHMnAYXhs7kelZLHtGqca8-TmaKNCiiYUzJ2eCPTcrfD7aoeKlBktQzrSlHXSz_ojAPkW5SATgIMrhK9_K5wXE3ahkri20fBJeo4lGRM7jbdvWBzaxKqWbtl-ZBu75MxgasKNhKQL7wVRupNSPhLXva2j0OWexiZzIi1qHTdJ4g_tUrdY4l-O-VBUhr9XXY55aybAGC1lwN-RK3Bf0UKuvtRu0Vn9-b6odNa9Sup557xInGcGY_0HGHvGyJeiNGMNKskPZYBC1kHE6eSnIg2xhBKv5UfzDpAakwGUdgapoiMm3hmavuYjvYESIHx-MG-BbT6wC2Eip2cVaLOUrXXp6oKFOnXSq05kt2f2rYhakXqucu.zcc2b-jDv5aTB3JshWR0WyRbbu9T9jldAPBtUqXMxO4&dib_tag=se&keywords=gaming&qid=1738000800&sr=8-26,"About this item Beyond Performance: Empower your gaming and creativity with the Nitro V 15, combining a 13th Gen Intel Core i5-13420H processor with the NVIDIA GeForce RTX 4050 Laptop GPU Picture-Perfect. Furiously Fast: See your digital conquests unfold in vibrant Full HD on a 15.6"" screen, perfectly timed at a quick 144Hz refresh rate and a wide 16:9 aspect ratio providing 82.64% screen-to-body ratio. Stay Connected: Your gaming sanctuary is wherever you are. On the couch? Settle in with fast and stable Wi-Fi 6. Gaming cafe? Get an edge online with Gigabit Ethernet. No matter your location, Nitro V 15 ensures you're always in the driver's seat. Thunderbolt 4: With the powerful Thunderbolt 4 port, you have the trifecta of power charging and data transfer with bidirectional movement and video display in one interface. Chilled to Perfection: Keep your cool amidst the fiercest gaming galaxies, thanks to Nitro V 15's innovative dual fans and effective exhaust system. Always Be Heard and Seen: Experience crystal clear communication with AI-powered Acer PurifiedView and PurifiedVoice noise reduction technology. You'll feel like you're in the command center of a spaceship, with pinpoint sound accuracy giving you the edge in your gaming skirmishes. No Limits with NitroSense: Channel your inner gaming strategist with the NitroSense utility app. Fine-tune your gaming setup to match your style, be it adjusting fan speeds for those heated battles or customizing lighting for immersive exploration Ports For All Your Accessories: 1 - USB Type-C Port USB 3.2 Gen 2 (up to 10 Gbps) DisplayPort over USB Type-C, Thunderbolt 4 & USB Charging, 1 - USB 3.2 Gen 2 Port (Featuring Power-off Charging), 2 - USB 3.2 Gen 1 ports, 1 - HDMI 2.1 Port with HDCP support, 1 - Headphone/Speaker/Line-out Jack, 1 - Ethernet (RJ-45), DC-in for AC adapter The Right Fit: 14.26"" W x 9.44"" D x 0.93/1.06"" H; 4.66 lbs. Show more › See more product details"
"Exquisite Gaming: Call of Duty: Monkeybomb - Original Mobile Phone & Gaming Controller Holder, Device Stand, Cable Guys, Licensed Figure",24.99,4.8,https://www.amazon.com/Exquisite-Gaming-Cable-Guys-Controller/dp/B08KJJFFY8/ref=sr_1_27?dib=eyJ2IjoiMSJ9.9mcadjYfGkCGNRSpf4OtmOtT6vZeuAykrxBJYpx3QYQnEzOJMvaoSji36PofYWZ-jQ6zrTDyMEO1lGzw2VHMnAYXhs7kelZLHtGqca8-TmaKNCiiYUzJ2eCPTcrfD7aoeKlBktQzrSlHXSz_ojAPkW5SATgIMrhK9_K5wXE3ahkri20fBJeo4lGRM7jbdvWBzaxKqWbtl-ZBu75MxgasKNhKQL7wVRupNSPhLXva2j0OWexiZzIi1qHTdJ4g_tUrdY4l-O-VBUhr9XXY55aybAGC1lwN-RK3Bf0UKuvtRu0Vn9-b6odNa9Sup557xInGcGY_0HGHvGyJeiNGMNKskPZYBC1kHE6eSnIg2xhBKv5UfzDpAakwGUdgapoiMm3hmavuYjvYESIHx-MG-BbT6wC2Eip2cVaLOUrXXp6oKFOnXSq05kt2f2rYhakXqucu.zcc2b-jDv5aTB3JshWR0WyRbbu9T9jldAPBtUqXMxO4&dib_tag=se&keywords=gaming&qid=1738000800&sr=8-27,"About this item MONKEYBOMB: Be careful - and don’t throw him, as he just might vaporize before your eyes. 8.5"" FIGURE: Heavy duty PVC statue and sturdy base that holds your stuff without tipping over. VERSATILE: Easily holds and displays most hand-held electronics, business cards, TV remotes, eBook readers, etc! GREAT GIFT IDEA: Calling all Call of Duty fans, this is a collectible figure must-have gift. An essential for any COD gamer. OFFICIALLY LICENSED: Your favorite pop culture characters - With A Purpose! Officially licensed by Activision - Call of Duty, styled on Monkey Bomb. › See more product details"
"RGB Mousepad Led Mouse Pad, Large Mouse Pad,Led and Big Mouse mat",9.99,4.6,https://www.amazon.com/RGB-Mousepad-Led-Mouse-Large/dp/B08QFB5KVS/ref=sr_1_28?dib=eyJ2IjoiMSJ9.9mcadjYfGkCGNRSpf4OtmOtT6vZeuAykrxBJYpx3QYQnEzOJMvaoSji36PofYWZ-jQ6zrTDyMEO1lGzw2VHMnAYXhs7kelZLHtGqca8-TmaKNCiiYUzJ2eCPTcrfD7aoeKlBktQzrSlHXSz_ojAPkW5SATgIMrhK9_K5wXE3ahkri20fBJeo4lGRM7jbdvWBzaxKqWbtl-ZBu75MxgasKNhKQL7wVRupNSPhLXva2j0OWexiZzIi1qHTdJ4g_tUrdY4l-O-VBUhr9XXY55aybAGC1lwN-RK3Bf0UKuvtRu0Vn9-b6odNa9Sup557xInGcGY_0HGHvGyJeiNGMNKskPZYBC1kHE6eSnIg2xhBKv5UfzDpAakwGUdgapoiMm3hmavuYjvYESIHx-MG-BbT6wC2Eip2cVaLOUrXXp6oKFOnXSq05kt2f2rYhakXqucu.zcc2b-jDv5aTB3JshWR0WyRbbu9T9jldAPBtUqXMxO4&dib_tag=se&keywords=gaming&qid=1738000800&sr=8-28,"About this item 【14Lighting Modes】This gaming mouse pad features 14 lighting modes: including colorful, dynamic breathing lighting mode and monochrome static lighting mode, making your gaming atmosphere warmer and more atmospheric. It also has a power-off memory function, which can memorize the mode you selected last time. 【Gaming Mouse Pad Large】The 31.5 x 12x 0.3 inch mouse pad fits your desktop perfectly and provides a lot of space for movement. The large mouse pad is suitable for computers and keyboards and mice, bringing the greatest help to your work environment or games. 【Easy to use】 This extended mouse pad has a button to control the lighting. Press once to change the color you like, press twice quickly to change the brightness, press and hold for about 3 seconds to turn on/off. The mouse pad is powered by USB, plug and play, no driver required. 【Super soft, smooth and waterproof】 The RGB gaming mouse pad is made of smooth microfiber material, which makes the mouse move more precise. The soft and smooth surface is more perfect for waterproofing. Effectively prevent damage from spilled beverages or other liquids, and is easy to clean with water without fading. Ideal for games or work [Rubber material] It is made of rubber material, which is stable and not easy to move. › See more product details"
"ACEMAGICIAN [Gaming PC] Ryzen Mini PC, AMD Ryzen 7 5875U(up to 4.5Ghz) 16GB DDR4 512GB NVME SSD Mini Desktop Computer, Mini Computers [WiFi6/BT5.2] [4K UHD/RGB Lights/3 Adjustable Mode PC Gaming]",4.0,4.2,https://www.amazon.com/Gaming-Desktop-Computer-Computers-Adjustable/dp/B0C4PF6GTQ/ref=sr_1_29?dib=eyJ2IjoiMSJ9.9mcadjYfGkCGNRSpf4OtmOtT6vZeuAykrxBJYpx3QYQnEzOJMvaoSji36PofYWZ-jQ6zrTDyMEO1lGzw2VHMnAYXhs7kelZLHtGqca8-TmaKNCiiYUzJ2eCPTcrfD7aoeKlBktQzrSlHXSz_ojAPkW5SATgIMrhK9_K5wXE3ahkri20fBJeo4lGRM7jbdvWBzaxKqWbtl-ZBu75MxgasKNhKQL7wVRupNSPhLXva2j0OWexiZzIi1qHTdJ4g_tUrdY4l-O-VBUhr9XXY55aybAGC1lwN-RK3Bf0UKuvtRu0Vn9-b6odNa9Sup557xInGcGY_0HGHvGyJeiNGMNKskPZYBC1kHE6eSnIg2xhBKv5UfzDpAakwGUdgapoiMm3hmavuYjvYESIHx-MG-BbT6wC2Eip2cVaLOUrXXp6oKFOnXSq05kt2f2rYhakXqucu.zcc2b-jDv5aTB3JshWR0WyRbbu9T9jldAPBtUqXMxO4&dib_tag=se&keywords=gaming&qid=1738000800&sr=8-29,"About this item [Unleash Your Gaming Potential with Ryzen 7 5875U] Powered by AMD Zen3 Ryzen 7 5875U, 8 Cores 16 Threads, Max Boost Clock up to 4.5GHz, and Radeon RX Vega8 Graphics(2000 MHz), our mini PC delivers up to 3.4% better performance in multitask computing compared to previous Zen 2 processors. Compared with AMD ryzen 5 5600U/5560U/5500U, ACEMAGICIAN S3A mini pc ryzen 7 5875U will be more powerful, providing faster speed and efficiency. [Multi-Mode Mini PC] Take your gaming to the next level with our multi-mode mini PC - choose from silent, auto, or performance mode to suit your needs and enjoy smart energy-saving features. ① Silent mode, fan sound as low as 38db and the power of mini pc is reduced to 10-15W, smart energy saving; ② Auto mode, suitable for medium work or entertainment projects, the mini pc power is setting as 15-20W; ③ performance mode, you can crank up the power to 20-25W, upgrade your gaming experience [16GB Dual Channel DDR4 & 512GB NVME SSD] With up to 16GB of DDR4-2666 RAM, dual-channel DDR4, and 2x M.2 NVME SSDs, you'll experience lightning-fast load times and nearly double the throughput of a single drive. Plus, with up to 512GB of storage space, you'll have plenty of room for all your favorite games [S3A, Fight for Speed] Stay connected and say goodbye to delays with our Mini Gaming PC. Featuring a 1G RJ45 port, WiFi 6 standard radio, and Bluetooth 5.2 technology, you'll enjoy peak interface bandwidth, efficiency, and reliability, with lower latency and less lag [RGB Lighting effect & High efficency cooling system] Gaming Small PC provides three different lighting modes for you to choose, you can choose your favorite lighting effect according to your mood. This Mini PC has a cooling module made from a blend of high tech copper alloy for efficient heat dissipation. This is backed up with a super high speed cooling fan. Allied together, you will keep your cool in the most intense gaming sessions! › See more product details"
"SteelSeries Arctis Nova Pro Wireless Multi-System Gaming Headset - Premium Hi-Fi Drivers - Active Noise Cancellation - Infinity Power System - ClearCast Gen 2 Mic - PS5, PS4, PC, Switch, Mobile",299.0,4.2,https://www.amazon.com/SteelSeries-Wireless-Multi-System-Headset-PlayStation-5/dp/B0CCXWH6WG/ref=sr_1_30?dib=eyJ2IjoiMSJ9.9mcadjYfGkCGNRSpf4OtmOtT6vZeuAykrxBJYpx3QYQnEzOJMvaoSji36PofYWZ-jQ6zrTDyMEO1lGzw2VHMnAYXhs7kelZLHtGqca8-TmaKNCiiYUzJ2eCPTcrfD7aoeKlBktQzrSlHXSz_ojAPkW5SATgIMrhK9_K5wXE3ahkri20fBJeo4lGRM7jbdvWBzaxKqWbtl-ZBu75MxgasKNhKQL7wVRupNSPhLXva2j0OWexiZzIi1qHTdJ4g_tUrdY4l-O-VBUhr9XXY55aybAGC1lwN-RK3Bf0UKuvtRu0Vn9-b6odNa9Sup557xInGcGY_0HGHvGyJeiNGMNKskPZYBC1kHE6eSnIg2xhBKv5UfzDpAakwGUdgapoiMm3hmavuYjvYESIHx-MG-BbT6wC2Eip2cVaLOUrXXp6oKFOnXSq05kt2f2rYhakXqucu.zcc2b-jDv5aTB3JshWR0WyRbbu9T9jldAPBtUqXMxO4&dib_tag=se&keywords=gaming&qid=1738000800&sr=8-30,"About this item ALMIGHTY AUDIO - Experience ultimate clarity and sound clarity with Premium High Fidelity Drivers. Fully customize the sound experience with the Sonar Software by using a first-in-gaming Pro-grade Parametric EQ. 360° SPATIAL AUDIO - Immersive surround sound transports you to the gaming world, letting you hear every critical step, reload, or vocal cue to give you an advantage.*Fully compatible with Tempest 3D Audio for PS5 / Microsoft Spatial Sound ACTIVE NOISE CANCELLATION - Immerse yourself in your virtual world as a specialized 4-mic hybrid system designed for gaming tunes out ambient noise. Use Transparency Mode with variable levels to adapt to any situation. INFINITY POWER SYSTEM - Hot-swap between using one battery while charging the other to keep your headset going and going and going. MULTI-SYSTEM CONNECT - Twin USB ports let you connect your PlayStation, PC, Mac, or Switch, and swap between them with the press of a button. › See more product details"
"2.4GHz Wireless Gaming Headset for PC, Ps5, Ps4 - Lossless Audio USB & Type-C Ultra Stable Gaming Headphones with Flip Microphone, 40-Hr Battery Gamer Headset for Switch, Laptop, Mobile, Mac",29.99,4.5,https://www.amazon.com/Ozeino-2-4GHz-Wireless-Gaming-Headset/dp/B0C4F9JGTJ/ref=sr_1_31?dib=eyJ2IjoiMSJ9.9mcadjYfGkCGNRSpf4OtmOtT6vZeuAykrxBJYpx3QYQnEzOJMvaoSji36PofYWZ-jQ6zrTDyMEO1lGzw2VHMnAYXhs7kelZLHtGqca8-TmaKNCiiYUzJ2eCPTcrfD7aoeKlBktQzrSlHXSz_ojAPkW5SATgIMrhK9_K5wXE3ahkri20fBJeo4lGRM7jbdvWBzaxKqWbtl-ZBu75MxgasKNhKQL7wVRupNSPhLXva2j0OWexiZzIi1qHTdJ4g_tUrdY4l-O-VBUhr9XXY55aybAGC1lwN-RK3Bf0UKuvtRu0Vn9-b6odNa9Sup557xInGcGY_0HGHvGyJeiNGMNKskPZYBC1kHE6eSnIg2xhBKv5UfzDpAakwGUdgapoiMm3hmavuYjvYESIHx-MG-BbT6wC2Eip2cVaLOUrXXp6oKFOnXSq05kt2f2rYhakXqucu.zcc2b-jDv5aTB3JshWR0WyRbbu9T9jldAPBtUqXMxO4&dib_tag=se&keywords=gaming&qid=1738000800&sr=8-31,"About this item 【Amazing Stable Connection-Quick Access to Games】Real-time gaming audio with our 2.4GHz USB & Type-C ultra-low latency wireless connection. With less than 30ms delay, you can enjoy smoother operation and stay ahead of the competition, so you can enjoy an immersive lag-free wireless gaming experience. 【Game Communication-Better Bass and Accuracy】The 50mm driver plus 2.4G lossless wireless transports you to the gaming world, letting you hear every critical step, reload, or vocal in Fortnite, Call of Duty, The Legend of Zelda and RPG, so you will never miss a step or shot during game playing. You will completely in awe with the range, precision, and audio quality your ears were experiencing. 【Flexible and Convenient Design-Effortless in Game】Ideal intuitive button layout on the headphones for user. Multi-functional button controls let you instantly crank or lower volume and mute, quickly answer phone calls, cut songs, turn on lights, etc. Ease of use and customization, are all done with passion and priority for the user. 【Less plug, More Play-Dual Input From 2.4GHz & Bluetooth】 Wireless gaming headset adopts high performance dual mode design. With a 2.4GHz USB dongle, which is super sturdy, lag＜30ms, perfectly made for gamers. Bluetooth mode only work for phone, laptop and switch. And 3.5mm wired mode (Only support music and call). 【Wide Compatibility with Gaming Devices】Setup the perfect entertainment system by plugging in 2.4G USB. The convenience of dual USB work seamlessly with your PS5,PS4, PC, Mac, Laptop, Switch and saves you from swapping cables. Bluetooth function can't directly support with Mac, Ps5, Ps4,Pc, additional USB Bluetooth Adapter is required (not included). Recommend to use the 2.4G mode, it easy and amazing connect. The 2 in 1 USB transmitter needs to be combined to connect for Ps/Ps2/Ps5/Ps4/PC/Laptop/Mac, can't be used separately. › See more product details"
"Razer BlackShark V2 X Gaming Headset: 7.1 Surround Sound - 50mm Drivers - Memory Foam Cushion - For PC, PS4, PS5, Switch - 3.5mm Audio Jack - Black",39.99,4.4,https://www.amazon.com/Razer-BlackShark-V2-Gaming-Headset/dp/B086PKMZ21/ref=sr_1_34?dib=eyJ2IjoiMSJ9.9mcadjYfGkCGNRSpf4OtmOtT6vZeuAykrxBJYpx3QYQnEzOJMvaoSji36PofYWZ-jQ6zrTDyMEO1lGzw2VHMnAYXhs7kelZLHtGqca8-TmaKNCiiYUzJ2eCPTcrfD7aoeKlBktQzrSlHXSz_ojAPkW5SATgIMrhK9_K5wXE3ahkri20fBJeo4lGRM7jbdvWBzaxKqWbtl-ZBu75MxgasKNhKQL7wVRupNSPhLXva2j0OWexiZzIi1qHTdJ4g_tUrdY4l-O-VBUhr9XXY55aybAGC1lwN-RK3Bf0UKuvtRu0Vn9-b6odNa9Sup557xInGcGY_0HGHvGyJeiNGMNKskPZYBC1kHE6eSnIg2xhBKv5UfzDpAakwGUdgapoiMm3hmavuYjvYESIHx-MG-BbT6wC2Eip2cVaLOUrXXp6oKFOnXSq05kt2f2rYhakXqucu.zcc2b-jDv5aTB3JshWR0WyRbbu9T9jldAPBtUqXMxO4&dib_tag=se&keywords=gaming&qid=1738000800&sr=8-34,"About this item ADVANCED PASSIVE NOISE CANCELLATION — sturdy closed earcups fully cover ears to prevent noise from leaking into the headset, with its cushions providing a closer seal for more sound isolation. 7.1 SURROUND SOUND FOR POSITIONAL AUDIO — Outfitted with custom-tuned 50 mm drivers, capable of software-enabled surround sound. *Only available on Windows 10 64-bit TRIFORCE TITANIUM 50MM HIGH-END SOUND DRIVERS — With titanium-coated diaphragms for added clarity, our new, cutting-edge proprietary design divides the driver into 3 parts for the individual tuning of highs, mids, and lowsproducing brighter, clearer audio with richer highs and more powerful lows LIGHTWEIGHT DESIGN WITH BREATHABLE FOAM EAR CUSHIONS — At just 240g, the BlackShark V2X is engineered from the ground up for maximum comfort RAZER HYPERCLEAR CARDIOID MIC — Improved pickup pattern ensures more voice and less noise as it tapers off towards the mic’s back and sides CROSS-PLATFORM COMPATIBILITY — Works with PC, Mac, PS4, Xbox One, Nintendo Switch via 3.5mm jack, enjoy unfair audio advantage across almost every platform. *Xbox One stereo adapter may be required, purchase separately #1 SELLING PC GAMING PERIPHERALS BRAND IN THE U.S. — Source — Circana, Retail Tracking Service, U.S., Dollar Sales, Gaming Designed Mice, Keyboards, and PC Headsets, Jan. 2019- Dec. 2023 combined › See more product details"
"Paladone Playstation Controller Icons Light with 3 Light Modes - Sound Reactive, Dynamic Phasing, and Standard Mode - Gaming Desk Accessories and Game Room Decor",18.99,4.7,https://www.amazon.com/Paladone-PP4140PS-Playstation-Icons-Light/dp/B079CBP6P9/ref=sr_1_36?dib=eyJ2IjoiMSJ9.9mcadjYfGkCGNRSpf4OtmOtT6vZeuAykrxBJYpx3QYQnEzOJMvaoSji36PofYWZ-jQ6zrTDyMEO1lGzw2VHMnAYXhs7kelZLHtGqca8-TmaKNCiiYUzJ2eCPTcrfD7aoeKlBktQzrSlHXSz_ojAPkW5SATgIMrhK9_K5wXE3ahkri20fBJeo4lGRM7jbdvWBzaxKqWbtl-ZBu75MxgasKNhKQL7wVRupNSPhLXva2j0OWexiZzIi1qHTdJ4g_tUrdY4l-O-VBUhr9XXY55aybAGC1lwN-RK3Bf0UKuvtRu0Vn9-b6odNa9Sup557xInGcGY_0HGHvGyJeiNGMNKskPZYBC1kHE6eSnIg2xhBKv5UfzDpAakwGUdgapoiMm3hmavuYjvYESIHx-MG-BbT6wC2Eip2cVaLOUrXXp6oKFOnXSq05kt2f2rYhakXqucu.zcc2b-jDv5aTB3JshWR0WyRbbu9T9jldAPBtUqXMxO4&dib_tag=se&keywords=gaming&qid=1738000800&sr=8-36,"About this item Light the night: light up your bedroom with the symbols and icons from the hugely popular and fun PlayStation gaming system. The PlayStation icon light illuminates the dark with a soft colorful glow. Conversation starter: when hosting your next party or game night at your home, get everyone talking about your iconic, stylish PlayStation icons light. Instantly recognizable, everyone will want one! Modes: this light has 3 different light modes with standard lighting and special effect color phasing. It's music reactive, so you can turn up the sound. Use this novel decoration for a themed room. Perfect present: this instantly recognizable PlayStation icon light makes a great present for geeks and fans of the popular gaming system. Perfect as a unique stocking stuffer or birthday present. Specifications: USB or battery powered light, approx. 30cm (12”) wide x 10cm (4”) tall. (Usb cable included, 3 x AAA batteries not included). officially licensed product. › See more product details"
