Title,Price,Rating,Link,Description
"Gaming Headset for PC, Ps4, Ps5, Xbox Headset with 7.1 Surround Sound, Gaming Headphones with Noise Cancelling Mic RGB Light Over Ear Headphones for Xbox Series X/S, Switch",24.99,4.5,https://www.amazon.com/Surround-Headphones-Cancelling-Flexible-Earmuffs/dp/B09TB15CTL/ref=sr_1_5?dib=eyJ2IjoiMSJ9.Vcl_jVwa4EZtxVhO1eHARrCbTWr8Dx3Qrfko5eNeKldW6wD05J6DrEU1RatlxlyE6MLkwGcgTu4sli-20WEKB0DvEaSJ3VXI0OSmqlmWx8u7O1Kr4TQWm1EjD7jmlok3ZokYS3yj5WvrcnDRrdp1aMghMdZGjXxksYJfJ3fz-cmriSofCltaGcbeGZ3EcDRn7tEfcLNzRogYU5KBsAHuoNzxLxEjv6HOouAVH0mYe9bHfoRQDzlXCCpHtz4igwaxOEuztPJ_TlxPTViwe0Ty-9tzEKvwkjo7zzCKdGDOLwfH2M4SD9TIWm--B6pq0qtMteTFYQ1RzVKPvjXMxhRFr5M3CsJbhR7I9F1QXJHxOEJBMFz8s_aLNg_KefkhHry3Hmb5h2zjR3BHUwxH9gngK3z4SUklwcc1Dx9B9U-vCcchNJ7SaH3Hi_rLNfdZVRhQ.5tY8fpWcf4edFAhwoLOAXQ0uVftHvMkRItWVSfJsaCI&dib_tag=se&keywords=gaming&qid=1738335401&sr=8-5,"About this item Superb 7.1 Surround Sound - Featuring a high-precision 50mm magnetic neodymium driver to create an immersive gaming experience with stereo surround sound in gaming headset for incredibly realistic sound. Cool style gaming experience - Colorful Led lights create a gorgeous game atmosphere, enhances your immersive gaming experience. Perfect for most FPS games like God of war, Fortnite, PUBG or CS: GO. Great Humanized Design - Comfortable and breathable permeability protein over-ear pads perfectly on your head, providing you with superior comfort during hours of gaming. The adjustable headband is very suitable for all gaming players of all ages. Gaming Platform Compatibility - This gaming headset support Ps5, Ps4, New Xbox, Xbox Series X/S, Switch, PC, Laptop, iOS, Mobile Phone and other devices with 3.5mm jack. Please note you need an extra Microsoft Adapter (Not Included) when connect with an old version Xbox One controller. Sensitivity Noise-Cancelling Microphone - 360° omnidirectionally rotatable sensitive microphone, premium noise cancellation, sound localisation, reduces distracting background noise to picks up your voice clearly to ensure your commands are always heard. *Note 1: When you use headset on your PC, be sure to connect the ""1-to-2 3.5mm audio jack splitter cable"" (Red-Mic, Green-audio). *Note 2: When your devices have a USB socket, the RGB lights can light up. The usb connector is only for led light power. › See more product details"
"Gaming Laptop AMD Ryzen 7 5825U(8C/16T), Radeon RX Vega 8 Graphics,16.1“FHD Display,16GB DDR4 512GB NVMe SSD Laptop Computer with Backlit KB,Type_C (Full Function),WiFi 6, 53Wh Battery",1699.99,4.5,https://www.amazon.com/MALLRACE-Graphics-Display-Computer-Function/dp/B0DKJM6L2L/ref=sr_1_6?dib=eyJ2IjoiMSJ9.Vcl_jVwa4EZtxVhO1eHARrCbTWr8Dx3Qrfko5eNeKldW6wD05J6DrEU1RatlxlyE6MLkwGcgTu4sli-20WEKB0DvEaSJ3VXI0OSmqlmWx8u7O1Kr4TQWm1EjD7jmlok3ZokYS3yj5WvrcnDRrdp1aMghMdZGjXxksYJfJ3fz-cmriSofCltaGcbeGZ3EcDRn7tEfcLNzRogYU5KBsAHuoNzxLxEjv6HOouAVH0mYe9bHfoRQDzlXCCpHtz4igwaxOEuztPJ_TlxPTViwe0Ty-9tzEKvwkjo7zzCKdGDOLwfH2M4SD9TIWm--B6pq0qtMteTFYQ1RzVKPvjXMxhRFr5M3CsJbhR7I9F1QXJHxOEJBMFz8s_aLNg_KefkhHry3Hmb5h2zjR3BHUwxH9gngK3z4SUklwcc1Dx9B9U-vCcchNJ7SaH3Hi_rLNfdZVRhQ.5tY8fpWcf4edFAhwoLOAXQ0uVftHvMkRItWVSfJsaCI&dib_tag=se&keywords=gaming&qid=1738335401&sr=8-6,"About this item 【Better Gaming Experience】 MALLRACE 2024 Newest AX16PRO gaming laptop is powered by AMD Ryzen 7 5825U processor (8C16T, up to 4.3GHz). Its powerful and upgraded performance ensures smooth game operation and high-quality display. Provide immersive gaming experience for gamers. 【LARGE MEMORY STORAGE】 The ryzen 7 laptop comes with up to 16GB of DDR4 memory, which responds faster to your commands. The built-in 512GB M.2 NVMe SSD is enough to accommodate system files and massive data, excellent reading and writing speed greatly shortening your startup time. Dual channel DDR4 memory support upgrade to 64GB (2x32GB), support NVME/NGFF SSD upgrade to 2TB. 【16.1"" FHD IPS Display】 This 16.1 inch laptop pc features an innovative thin-bezel display that provides more usable onscreen space for immersive FHD viewing. It comes with Webcam×1, HDMI×1, Type_C (Full function)×1, 3.5mm Audio/Mic×1, TF Card Socket×1, Type_C DC Jack×1, USB3.2×2, USB2.0×1. Also paired with a backlit keyboard and numeric keypad, providing you with a full range of control comfort. 【Rich and High-quality Scalability】 Designed for ultra-fast gaming, MALLRACE Newest AX16PRO equipped with webcam × 1, USB 3.2 × 2, HDMI × 1, Type_C (full function) × 1, 3.5mm audio/microphone × 1, TF card holder × 1, Type_C DC jack × 1. Enjoy higher speeds with Wi-Fi 6, compatible with the 802.11ax standard and up to 3x faster than Wi-Fi 5. Paired with the backlit keyboard, it help you more immersed in the game world. 【MALLRACE CARE FOR YOU】 This traditional laptop computer is designed with a metal shell to resist pressure and impact, and its 53Wh long battery life gives you the flexibility to work or play anywhere without carrying a power adaptor, while being thin and light enough to easily slip into a backpack. We offer lifetime technical support and 12 months quality warranty for customers. If you have any questions, please feel free to contact us. › See more product details"
Abstract Topographic Map White Grey Black Gaming Mouse Pad Long Mouse Pad Large Desk Mat 31.5 X 11.8 Inch Mousepad with Non-Slip Base Stitched Edge Keyboard Mat for Gaming Office,9.9,4.5,https://www.amazon.com/Abstract-Topographic-Mousepad-Non-Slip-Stitched/dp/B0C5Q653LF/ref=sr_1_7?dib=eyJ2IjoiMSJ9.Vcl_jVwa4EZtxVhO1eHARrCbTWr8Dx3Qrfko5eNeKldW6wD05J6DrEU1RatlxlyE6MLkwGcgTu4sli-20WEKB0DvEaSJ3VXI0OSmqlmWx8u7O1Kr4TQWm1EjD7jmlok3ZokYS3yj5WvrcnDRrdp1aMghMdZGjXxksYJfJ3fz-cmriSofCltaGcbeGZ3EcDRn7tEfcLNzRogYU5KBsAHuoNzxLxEjv6HOouAVH0mYe9bHfoRQDzlXCCpHtz4igwaxOEuztPJ_TlxPTViwe0Ty-9tzEKvwkjo7zzCKdGDOLwfH2M4SD9TIWm--B6pq0qtMteTFYQ1RzVKPvjXMxhRFr5M3CsJbhR7I9F1QXJHxOEJBMFz8s_aLNg_KefkhHry3Hmb5h2zjR3BHUwxH9gngK3z4SUklwcc1Dx9B9U-vCcchNJ7SaH3Hi_rLNfdZVRhQ.5tY8fpWcf4edFAhwoLOAXQ0uVftHvMkRItWVSfJsaCI&dib_tag=se&keywords=gaming&qid=1738335401&sr=8-7,"About this item 【Material and Quality】This large mouse pad are made of rubber. The surface is image printing and very smooth. The image quality is awesome. 【Packaged】This long mouse pad is rolled up and packaged instead of folded in half, so there will be no creases and bumps. 【Extended Size】31.5×11.8×0.12 inches( 800mm x 300mm x 3mm) gaming mouse pad covers a wide desk area to accommodate your mouse and keyboard, It's a wonderful size. You can get so many compliments at work and gaming! 【Easy to Clean】This oversized desk mat protects your desktop from drinks, ink, spilled water, and other liquid. If your mouse pad is dirty, you can wash it with clean water and let it dry. 【Why Choose Us】This Mouse Pad is Beautifully designed and made, premium feel, is much more snag-less than some other nylon mousepads, and tracking across it is great. You can give it to your family, friends, classmates, colleague, or lovers as a gift. › See more product details"
"LED Light Bar, Music Sync RGB IC Light Bar, USB Ambient Lamp, Color Changing Gaming TV Backlight with Remote Control, 15 Dynamic Modes for Room Gaming Decoration",15.99,4.3,https://www.amazon.com/MICTUL-Ambient-Changing-Backlight-Decoration/dp/B0CCJ8FC5S/ref=sr_1_8?dib=eyJ2IjoiMSJ9.Vcl_jVwa4EZtxVhO1eHARrCbTWr8Dx3Qrfko5eNeKldW6wD05J6DrEU1RatlxlyE6MLkwGcgTu4sli-20WEKB0DvEaSJ3VXI0OSmqlmWx8u7O1Kr4TQWm1EjD7jmlok3ZokYS3yj5WvrcnDRrdp1aMghMdZGjXxksYJfJ3fz-cmriSofCltaGcbeGZ3EcDRn7tEfcLNzRogYU5KBsAHuoNzxLxEjv6HOouAVH0mYe9bHfoRQDzlXCCpHtz4igwaxOEuztPJ_TlxPTViwe0Ty-9tzEKvwkjo7zzCKdGDOLwfH2M4SD9TIWm--B6pq0qtMteTFYQ1RzVKPvjXMxhRFr5M3CsJbhR7I9F1QXJHxOEJBMFz8s_aLNg_KefkhHry3Hmb5h2zjR3BHUwxH9gngK3z4SUklwcc1Dx9B9U-vCcchNJ7SaH3Hi_rLNfdZVRhQ.5tY8fpWcf4edFAhwoLOAXQ0uVftHvMkRItWVSfJsaCI&dib_tag=se&keywords=gaming&qid=1738335401&sr=8-8,"About this item Dynamic Audio Sync: The LED light bars are built into a music-tracking sensor. You can simply click the Smooth mode with the remote to reach your most desired dynamic expression for your chosen music. Perfect for gaming, watching movies, playing music, parties, and more Immersive Light Experience: MICTUL RGB light bar adds gorgeous of color to your home theater creating a more impressive entertainment system. Enhance your gaming, movie, and music experience with vibrant lighting and multiple dynamic modes 2.4G RF Remote Control: you can adjust the brightness, color, and mode remotely even on the bed or sofa at will. A perfect surprise for friends, music lovers, designers, and marketers USB Interface Powered: The tv light bar comes with 5V powered USB cable, which can be easily plugged into a PC, TV, and power bank. Please note that the 2-pack cannot be divided or shipped separately (USB cable length: 36 inches) Easy to Set Up & Portable: This rhythm light bar is easy to install and set up, featuring a lightweight design and a compact size that allows for versatility and adaptability in any living space. It effortlessly creates an atmosphere that perfectly sets the desired mood › See more product details"
"Gaming Microphone, USB PC Mic for Podcasts Videos, Streaming, Condenser Mic with Quick Mute, Tripod Stand, Pop Filter, RGB Indicator, Shock Mount, Rotate gain button, Compatible with PS4/5/PC",19.98,4.3,https://www.amazon.com/COCONISE-Microphone-Streaming-Condenser-Compatible/dp/B0BXPFNNF9/ref=sr_1_9?dib=eyJ2IjoiMSJ9.Vcl_jVwa4EZtxVhO1eHARrCbTWr8Dx3Qrfko5eNeKldW6wD05J6DrEU1RatlxlyE6MLkwGcgTu4sli-20WEKB0DvEaSJ3VXI0OSmqlmWx8u7O1Kr4TQWm1EjD7jmlok3ZokYS3yj5WvrcnDRrdp1aMghMdZGjXxksYJfJ3fz-cmriSofCltaGcbeGZ3EcDRn7tEfcLNzRogYU5KBsAHuoNzxLxEjv6HOouAVH0mYe9bHfoRQDzlXCCpHtz4igwaxOEuztPJ_TlxPTViwe0Ty-9tzEKvwkjo7zzCKdGDOLwfH2M4SD9TIWm--B6pq0qtMteTFYQ1RzVKPvjXMxhRFr5M3CsJbhR7I9F1QXJHxOEJBMFz8s_aLNg_KefkhHry3Hmb5h2zjR3BHUwxH9gngK3z4SUklwcc1Dx9B9U-vCcchNJ7SaH3Hi_rLNfdZVRhQ.5tY8fpWcf4edFAhwoLOAXQ0uVftHvMkRItWVSfJsaCI&dib_tag=se&keywords=gaming&qid=1738335401&sr=8-9,"About this item Gradient RGB Symphony Lights: Cyclic and gradient RGB lights, in line with your live broadcast aesthetics. Bring you an immersive gaming experience and awaken all your senses. There's also a palpable sense of security, and when the COCONISE microphone is muted, the RGB lights go off to let you know you're working. Prevent accidents when you forget to mute your PC microphone for gaming. Practical and convenient function: It is equipped with a one-button mute touch sensor. When you want to close the microphone, you only need to touch it lightly to mute the sound, and the RGB light will go out to inform you that the microphone has been successfully closed. Equipped with a rotary control volume button at the bottom. There is a 3.5MM headphone jack in the middle, you can plug in the headphones to monitor your own voice in real-time and make adjustments in time when recording. Cardioid Polar Pattern: This microphone features a cardioid polar pattern that captures crisp, smooth, and clear sound in front of the microphone, reducing side pickup so it can focus on your voice. At the same time, it is equipped with a 25mm ultra-large capacitor diaphragm capsule, which can capture a wider range of audio with a sampling rate of up to 192kHz, and the pickup is delicate and noise-free. SOLID FIT: With a weighted carbon steel base, your big movements won't knock the mic down, even during intense gaming sessions. The detachable metal anti-splash screen is adopted. Compared with the sponge, the metal anti-splash screen can filter the plosive sound more effectively. And the rubber elastic band is firmly clamped on the shock mount, which can reduce the vibration noise caused by violent keyboard tapping and mouse clicking. Plug and Play:PC gaming microphone for streaming, compatible with PS4/PS4pro/PS5 desktop and laptop. You can quickly enter the game chat. The 180CM long detachable USB data cable can be extended from the back of the computer host to the main body of your gaming USB microphone without limitation. › See more product details"
"ASUS ROG Strix G16 Gaming Laptop, 16” 16:10 FHD 165Hz Display, NVIDIA® GeForce RTX™ 4060, Intel Core i7-13650HX, 16GB DDR5, 1TB PCIe Gen4 SSD, Wi-Fi 6E, Windows 11, G614JV-AS74",1317.75,4.3,https://www.amazon.com/ASUS-ROG-Strix-Gaming-Laptop/dp/B0CRDCXRK2/ref=sr_1_10?dib=eyJ2IjoiMSJ9.Vcl_jVwa4EZtxVhO1eHARrCbTWr8Dx3Qrfko5eNeKldW6wD05J6DrEU1RatlxlyE6MLkwGcgTu4sli-20WEKB0DvEaSJ3VXI0OSmqlmWx8u7O1Kr4TQWm1EjD7jmlok3ZokYS3yj5WvrcnDRrdp1aMghMdZGjXxksYJfJ3fz-cmriSofCltaGcbeGZ3EcDRn7tEfcLNzRogYU5KBsAHuoNzxLxEjv6HOouAVH0mYe9bHfoRQDzlXCCpHtz4igwaxOEuztPJ_TlxPTViwe0Ty-9tzEKvwkjo7zzCKdGDOLwfH2M4SD9TIWm--B6pq0qtMteTFYQ1RzVKPvjXMxhRFr5M3CsJbhR7I9F1QXJHxOEJBMFz8s_aLNg_KefkhHry3Hmb5h2zjR3BHUwxH9gngK3z4SUklwcc1Dx9B9U-vCcchNJ7SaH3Hi_rLNfdZVRhQ.5tY8fpWcf4edFAhwoLOAXQ0uVftHvMkRItWVSfJsaCI&dib_tag=se&keywords=gaming&qid=1738335401&sr=8-10,"About this item POWER UP YOUR PLAY - Win more games with Windows 11, a 13th Gen Intel Core i7-13650HX processor, and an NVIDIA GeForce RTX 4060 Laptop GPU at 140W Max TGP. BLAZING FAST MEMORY AND STORAGE – Multitask swiftly with 16GB of DDR5-4800MHz memory and 1TB of PCIe Gen4 SSD. ROG INTELLIGENT COOLING – The Strix G16 features Thermal Grizzly’s Conductonaut Extreme liquid metal on the CPU, and a third intake fan among other premium features, to allow for better sustained performance over long gaming sessions. SWIFT DISPLAY – The Strix G16 features a FHD 165Hz panel, 100% sRGB, Pantone Validation, among other premium features on the Strix G16. XBOX GAME PASS – Get a free 90-day pass and gain access to over 100 high-quality games. With games added all the time, there’s always something new to play › See more product details"
"BENGOO G9000 Stereo Gaming Headset for PS4 PC Xbox One PS5 Controller, Noise Cancelling Over Ear Headphones with Mic, LED Light, Bass Surround, Soft Memory Earmuffs (Blue)",19.99,4.3,https://www.amazon.com/BENGOO-G9000-Controller-Cancelling-Headphones/dp/B01H6GUCCQ/ref=sr_1_11?dib=eyJ2IjoiMSJ9.Vcl_jVwa4EZtxVhO1eHARrCbTWr8Dx3Qrfko5eNeKldW6wD05J6DrEU1RatlxlyE6MLkwGcgTu4sli-20WEKB0DvEaSJ3VXI0OSmqlmWx8u7O1Kr4TQWm1EjD7jmlok3ZokYS3yj5WvrcnDRrdp1aMghMdZGjXxksYJfJ3fz-cmriSofCltaGcbeGZ3EcDRn7tEfcLNzRogYU5KBsAHuoNzxLxEjv6HOouAVH0mYe9bHfoRQDzlXCCpHtz4igwaxOEuztPJ_TlxPTViwe0Ty-9tzEKvwkjo7zzCKdGDOLwfH2M4SD9TIWm--B6pq0qtMteTFYQ1RzVKPvjXMxhRFr5M3CsJbhR7I9F1QXJHxOEJBMFz8s_aLNg_KefkhHry3Hmb5h2zjR3BHUwxH9gngK3z4SUklwcc1Dx9B9U-vCcchNJ7SaH3Hi_rLNfdZVRhQ.5tY8fpWcf4edFAhwoLOAXQ0uVftHvMkRItWVSfJsaCI&dib_tag=se&keywords=gaming&qid=1738335401&sr=8-11,"About this item 【Multi-Platform Compatible】Support PlayStation 4, New Xbox One, PC, Nintendo 3DS, Laptop, PSP, Tablet, iPad, Computer, Mobile Phone. Please note you need an extra Microsoft Adapter (Not Included) when connect with an old version Xbox One controller. 【Surrounding Stereo Subwoofer】Clear sound operating strong brass, splendid ambient noise isolation and high precision 40mm magnetic neodymium driver, acoustic positioning precision enhance the sensitivity of the speaker unit, bringing you vivid sound field, sound clarity, shock feeling sound. Perfect for various games like Halo 5 Guardians, Metal Gear Solid, Call of Duty, Star Wars Battlefront, Overwatch, World of Warcraft Legion, etc. 【Noise Isolating Microphone】Headset integrated onmi-directional microphone can transmits high quality communication with its premium noise-concellng feature, can pick up sounds with great sensitivity and remove the noise, which enables you clearly deliver or receive messages while you are in a game. Long flexible mic design very convenient to adjust angle of the microphone. 【Great Humanized Design】Superior comfortable and good air permeability protein over-ear pads, muti-points headbeam, acord with human body engineering specification can reduce hearing impairment and heat sweat.Skin friendly leather material for a longer period of wearing. Glaring LED lights desigend on the earcups to highlight game atmosphere. 【Effortlessly Volume Control】High tensile strength, anti-winding braided USB cable with rotary volume controller and key microphone mute effectively prevents the 49-inches long cable from twining and allows you to control the volume easily and mute the mic as effortless volume control one key mute. › See more product details"
"Rotating Headphone Stand - EURPMASK PC Gaming Headset Stand, Adjustable Clamp-on Headphone Holder, Headphone Hanger Hook Under Desk with 360 Degree Swivel&Cable Clip Organizer - Black",13.99,4.7,https://www.amazon.com/Headphone-Headphones-Adjustable-Universal-EURPMASK/dp/B07BVK2FQW/ref=sr_1_12?dib=eyJ2IjoiMSJ9.Vcl_jVwa4EZtxVhO1eHARrCbTWr8Dx3Qrfko5eNeKldW6wD05J6DrEU1RatlxlyE6MLkwGcgTu4sli-20WEKB0DvEaSJ3VXI0OSmqlmWx8u7O1Kr4TQWm1EjD7jmlok3ZokYS3yj5WvrcnDRrdp1aMghMdZGjXxksYJfJ3fz-cmriSofCltaGcbeGZ3EcDRn7tEfcLNzRogYU5KBsAHuoNzxLxEjv6HOouAVH0mYe9bHfoRQDzlXCCpHtz4igwaxOEuztPJ_TlxPTViwe0Ty-9tzEKvwkjo7zzCKdGDOLwfH2M4SD9TIWm--B6pq0qtMteTFYQ1RzVKPvjXMxhRFr5M3CsJbhR7I9F1QXJHxOEJBMFz8s_aLNg_KefkhHry3Hmb5h2zjR3BHUwxH9gngK3z4SUklwcc1Dx9B9U-vCcchNJ7SaH3Hi_rLNfdZVRhQ.5tY8fpWcf4edFAhwoLOAXQ0uVftHvMkRItWVSfJsaCI&dib_tag=se&keywords=gaming&qid=1738335401&sr=8-12,"About this item 【Clamp-on Headphone Stand】The E-Hold Series headphone holder fits desks from 0.31 inch to 1.57 inch thick, making it a versatile choice for most setups. The spring clamp is a breeze to remove and reattach. No glue, no mess. It blends seamlessly into your space, whether it's your desk, shelf, or other surface. 【Rotating Adjustable Headphone Arm】Experience effortless access to your headphones with 360-degree swivel design. The gaming headset stand makes it easy to get your desired directions, even tucking them neatly under your desk when not in use. 【Built in Cable Organizer】The headphone hanger features cable clip to hold your headset's cable in place. It's the perfect desk accessory to ensure your gaming setup and office desk remain tidy and organized. 【Curved Edge&Rubber Pads】: Eurpmask's headset holder comes with curved edges and soft rubber pads to safeguard your headset. Plus, rubber pads on the clamp ends prevent damage to your desk or table, whether it's glass,wood,metal,ect. 【Universal Fit】: This headset stand is compatible with almost all wireless and wired headphones,it is the perfect gift for gamers, a must-have gaming desk accessory. It also hang the bag, hat, umbrella and other daily gadgets in your kitchen counter, bookshelf, entrance cabinet. 【Ideal Choice for Gift】: This Headphone stand under desk is good choice for stocking stuffers, christmas gifts, birthday gifts, Easter gifts, gamer gifts. › See more product details"
"Xbox Core Wireless Gaming Controller – Deep Pink Series X|S, One, Windows PC, Android, and iOS",52.99,4.6,https://www.amazon.com/Xbox-Core-Wireless-Controller-Deep-Controllers/dp/B09VV5LJS1/ref=sr_1_13?dib=eyJ2IjoiMSJ9.Vcl_jVwa4EZtxVhO1eHARrCbTWr8Dx3Qrfko5eNeKldW6wD05J6DrEU1RatlxlyE6MLkwGcgTu4sli-20WEKB0DvEaSJ3VXI0OSmqlmWx8u7O1Kr4TQWm1EjD7jmlok3ZokYS3yj5WvrcnDRrdp1aMghMdZGjXxksYJfJ3fz-cmriSofCltaGcbeGZ3EcDRn7tEfcLNzRogYU5KBsAHuoNzxLxEjv6HOouAVH0mYe9bHfoRQDzlXCCpHtz4igwaxOEuztPJ_TlxPTViwe0Ty-9tzEKvwkjo7zzCKdGDOLwfH2M4SD9TIWm--B6pq0qtMteTFYQ1RzVKPvjXMxhRFr5M3CsJbhR7I9F1QXJHxOEJBMFz8s_aLNg_KefkhHry3Hmb5h2zjR3BHUwxH9gngK3z4SUklwcc1Dx9B9U-vCcchNJ7SaH3Hi_rLNfdZVRhQ.5tY8fpWcf4edFAhwoLOAXQ0uVftHvMkRItWVSfJsaCI&dib_tag=se&keywords=gaming&qid=1738335401&sr=8-13,"About this item XBOX DEEP PINK WIRELESS CONTROLLER: Experience the modernized design of the Xbox Wireless Controller, featuring sculpted surfaces and refined geometry for enhanced comfort during gameplay with battery life up to 40 hours.* STAY ON TARGET: New hybrid D-pad and textured grip on the triggers, bumpers, and back-case. SHARE BUTTON: Seamlessly capture and share content such as screenshots, recordings, and more with the new Share button. PLAY ACROSS DEVICES: Includes Xbox Wireless and Bluetooth technology so you can easily pair and switch between devices including Xbox Series X, Xbox Series S, Xbox One, Windows PC, Android, and iOS.* COMPATIBILITY: Plug in any compatible headset with the 3.5mm audio headset jack. Connect using the USB-C port for direct plug and play to console or PC.* CUSTOM BUTTON MAPPING: Make the controller your own by customizing button mappings with the Xbox Accessories app.* › See more product details"
"Logitech G502 HERO High Performance Wired Gaming Mouse, HERO 25K Sensor, 25,600 DPI, RGB, Adjustable Weights, 11 Programmable Buttons, On-Board Memory, PC / Mac",44.8,4.6,https://www.amazon.com/Logitech-G502-Performance-Gaming-Mouse/dp/B07GBZ4Q68/ref=sr_1_14?dib=eyJ2IjoiMSJ9.Vcl_jVwa4EZtxVhO1eHARrCbTWr8Dx3Qrfko5eNeKldW6wD05J6DrEU1RatlxlyE6MLkwGcgTu4sli-20WEKB0DvEaSJ3VXI0OSmqlmWx8u7O1Kr4TQWm1EjD7jmlok3ZokYS3yj5WvrcnDRrdp1aMghMdZGjXxksYJfJ3fz-cmriSofCltaGcbeGZ3EcDRn7tEfcLNzRogYU5KBsAHuoNzxLxEjv6HOouAVH0mYe9bHfoRQDzlXCCpHtz4igwaxOEuztPJ_TlxPTViwe0Ty-9tzEKvwkjo7zzCKdGDOLwfH2M4SD9TIWm--B6pq0qtMteTFYQ1RzVKPvjXMxhRFr5M3CsJbhR7I9F1QXJHxOEJBMFz8s_aLNg_KefkhHry3Hmb5h2zjR3BHUwxH9gngK3z4SUklwcc1Dx9B9U-vCcchNJ7SaH3Hi_rLNfdZVRhQ.5tY8fpWcf4edFAhwoLOAXQ0uVftHvMkRItWVSfJsaCI&dib_tag=se&keywords=gaming&qid=1738335401&sr=8-14,"About this item Hero 25K sensor through a software update from G HUB, this upgrade is free to all players: Our most advanced, with 1:1 tracking, 400-plus ips, and 100 - 25,600 max dpi sensitivity plus zero smoothing, filtering, or acceleration 11 customizable buttons and onboard memory: Assign custom commands to the buttons and save up to five ready to play profiles directly to the mouse Adjustable weight system: Arrange up to five removable 3.6 grams weights inside the mouse for personalized weight and balance tuning Programmable RGB Lighting and Lightsync technology: Customize lighting from nearly 16.8 million colors to match your team's colors, sport your own or sync colors with other Logitech G gear Mechanical switch button tensioning: Metal spring tensioning system and pivot hinges are built into left and right gaming mouse buttons for a crisp, clean click feel with rapid click feedback 1 year hardware limited warranty. USB report rate: 1000Hz (1ms) Microprocessor: 32-bit ARM. Use Logitech G HUB to save your settings to the on board memory on the mouse and take them with you. Your saved settings will work on any PC without additional software or any login required. › See more product details"
"Redragon K585 DITI Wired One-Handed RGB Mechanical Gaming Keyboard, 42 Keys Type-C Professional Gaming Keypad w/Upgraded Hot-Swappable Socket, 7 Onboard Macro Keys & Detachable Wrist Rest",36.99,4.3,https://www.amazon.com/Redragon-K585-One-Handed-Mechanical-Professional/dp/B07NBJVH4G/ref=sr_1_16?dib=eyJ2IjoiMSJ9.Vcl_jVwa4EZtxVhO1eHARrCbTWr8Dx3Qrfko5eNeKldW6wD05J6DrEU1RatlxlyE6MLkwGcgTu4sli-20WEKB0DvEaSJ3VXI0OSmqlmWx8u7O1Kr4TQWm1EjD7jmlok3ZokYS3yj5WvrcnDRrdp1aMghMdZGjXxksYJfJ3fz-cmriSofCltaGcbeGZ3EcDRn7tEfcLNzRogYU5KBsAHuoNzxLxEjv6HOouAVH0mYe9bHfoRQDzlXCCpHtz4igwaxOEuztPJ_TlxPTViwe0Ty-9tzEKvwkjo7zzCKdGDOLwfH2M4SD9TIWm--B6pq0qtMteTFYQ1RzVKPvjXMxhRFr5M3CsJbhR7I9F1QXJHxOEJBMFz8s_aLNg_KefkhHry3Hmb5h2zjR3BHUwxH9gngK3z4SUklwcc1Dx9B9U-vCcchNJ7SaH3Hi_rLNfdZVRhQ.5tY8fpWcf4edFAhwoLOAXQ0uVftHvMkRItWVSfJsaCI&dib_tag=se&keywords=gaming&qid=1738335401&sr=8-16,"About this item Slim and Tactical - The K585 keyboard gets rid of those extra keys and keeps the most useful ones in a slim & portable package. All of your keyboard action keys are in one convenient place. No need to worry about misclicked keys. Upgraded Hot-Swap - The upgraded socket is now available on Redragon one-handed keyboard, with more ways to mod, and more fun. The iconic Redragon Blue Switches deliver audible clicky with clear tactile feedback, original mechanical feel. Play to Win - With 7 programmable macro keys, binding multiple commands and activating them instantly is simple and quick. Assign single or multiple keystrokes to any macro key to save precious time in the middle of battle. Light it Up in Your Way - 5 RGB backlit modes are selectable with 16.8 Million Colors. Glorious & amazing lighting effects let the light of victory wreak havoc in the dark. USB Pass-Through Port - Positioned for uninterrupted game play and ready for your mouse, headset adapter, or other USB device. Form & Function - Ergonomically designed with a detachable wrist-rest section connected by magnets, the wrist-rest offers great support to make use more comfortable. › See more product details"
